Link,Name,Brand,Price,Sale,Stars,NumberOfCoupon,5 stars,4 stars,3 stars,2 stars,1 star,Reviews
https://tiki.vn/ke-dung-my-pham-de-ban-3-ngan-tu-dung-my-pham-do-trang-diem-co-nap-day-hang-chinh-hang-p185438523.html?spid=185438527,"Kệ Đựng Mỹ Phẩm Để Bàn 3 Ngăn, Tủ Đựng Mỹ Phẩm, Đồ Trang Điểm Có Nắp Đậy - Hàng Chính Hãng",ENCOVINA,295.000₫,Đã bán 702,4.8,1.0,14,4,0,0,0,
https://tiki.vn/ghe-gac-chan-cong-thai-hoc-ergonomic-footrest-ghe-ke-chan-ghe-gac-chan-van-phong-p186627908.html?spid=214048129,"Ghế Gác Chân Công Thái Học Ergonomic Footrest, Ghế Kê Chân Ghế Gác Chân Văn Phòng",OEM,278.000₫,Đã bán 2005,4.8,3.0,235,33,4,3,2,
https://tiki.vn/ke-de-giay-dep-sagoker-ma-ked201-p182432982.html?spid=182432996,"KỆ ĐỂ GIÀY DÉP SAGOKER, mã KED201",SAGOKER,159.999₫,Đã bán 359,4.8,,76,7,3,1,0,
https://tiki.vn/ban-hoc-gap-gon-ban-laptop-da-nang-tuy-chinh-duoc-goc-nghieng-giam-dau-lung-moi-mat-gm55-p181361773.html?spid=181361777,"Bàn học gấp gọn, bàn laptop đa năng tùy chỉnh được góc nghiêng giảm đau lưng mỏi mắt - GM55",IGA,219.000₫,Đã bán 308,4.5,1.0,21,4,1,3,1,
https://tiki.vn/ban-lam-viec-phong-cach-bac-au-thuong-hieu-igea-khong-bao-gom-ghe-p208413993.html?spid=208413997,Bàn Làm Việc Phong Cách Bắc Âu Thương Hiệu IGEA (Không Bao Gồm Ghế),IGA,436.000₫,Đã bán 2871,4.5,1.0,654,172,39,24,44,
https://tiki.vn/guong-dan-tuong-thuy-tinh-do-trong-suot-cao-hinh-anh-sac-net-khong-mop-meo-p148883107.html?spid=148883109,Gương Dán Tường Thủy Tinh Độ Trong Suốt Cao Hình Ảnh Sắc Nét Không Móp Méo,OEM,190.000₫,Đã bán 227,4.7,,38,6,1,0,1,
https://tiki.vn/ghe-tatami-ghe-luoi-bet-tua-lung-nem-co-5-cap-do-nga-lung-chinh-hang-tido-p103755910.html?spid=103755914,"Ghế tatami, ghế lười bệt tựa lưng nệm - Có 5 cấp độ ngã lưng - Chính hãng TIDO",TIDO,366.000₫,Đã bán 631,4.8,2.0,163,27,3,1,0,
https://tiki.vn/hop-dung-giay-nhua-cung-cao-cap-size-lon-cua-nam-cham-lap-rap-tien-loi-song-anh-hang-chinh-hang-p162548473.html?spid=162548477,Hộp Đựng Giày Nhựa Cứng Cao Cấp Size Lớn Cửa Nam Châm Lắp Ráp Tiện Lợi Song Anh- Hàng Chính Hãng,Song Anh,90.250₫,Đã bán 2122,4.5,,81,19,4,2,9,
https://tiki.vn/-tikinow-giao-hang-ghe-chinh-dang-ngoi-dung-roichen-nu-mau-do-xanh-mint-ghi-xam-roichen-han-quoc-made-in-korea-hang-chinh-hang-p201687096.html?spid=263576301,"[TikiNow giao hàng] Ghế chỉnh dáng ngồi đúng Roichen - Hàn Quốc. Sản phẩm dành cho Nữ , Sản phẩm nhập khẩu Hàn Quốc (Made in Korea). Hàng chính hãng Roichen",Roichen,655.000₫,Đã bán 210,5.0,6.0,34,1,0,0,0,
https://tiki.vn/may-tam-nuoc-cam-tay-oral-irrigator-ban-quoc-te-chuan-xuat-chau-au-p252036287.html?spid=252036288,Máy Tăm Nước Cầm Tay Oral Irrigator Bản Quốc Tế Chuẩn Xuất Châu Âu,OEM,148.000₫,Đã bán 207,,,,,,,,
https://tiki.vn/ke-de-giay-dep-5-tang-go-mdf-p83377541.html?spid=160306453,KỆ ĐỂ GIÀY DÉP 5 TẦNG GỖ MDF,OEM,170.000₫,Đã bán 88,4.3,,6,5,2,0,0,
https://tiki.vn/hop-dung-trang-suc-boc-da-hai-tang-co-khoa-hop-dung-nu-trang-cao-cap-p198572219.html?spid=198572221,Hộp Đựng Trang Sức Bọc Da Hai Tầng Có Khóa - Hộp Đựng Nữ Trang Cao Cấp,OEM,295.000₫,Đã bán 35,5.0,,6,0,0,0,0,
https://tiki.vn/ke-sach-gia-sach-de-ban-tien-ich-p53993254.html?spid=70882447,"Kệ Sách, Giá Sách Để Bàn Tiện Ích",OEM,80.000₫,Đã bán 162,4.3,5.0,30,10,4,4,1,
https://tiki.vn/tu-ke-sach-de-ban-ht002-20x35x60cm-p33404972.html?spid=102121893,Kệ sách để bàn HT003,OEM,65.000₫,Đã bán 252,4.5,5.0,31,4,1,0,4,
https://tiki.vn/gia-do-treo-o-cam-dien-day-dien-khong-can-duc-lo-mang-treo-day-dien-duoi-ban-tien-loi-cho-decor-phong-lam-viec-hang-chinh-hang-tamayoko-p271365709.html?spid=271365711,"Giá Đỡ Treo Ổ Cắm Điện, Dây Điện Không Cần Đục Lỗ - Máng Treo Dây Điện Dưới Bàn Tiện Lợi Cho Decor Phòng Làm Việc. Hàng Chính Hãng Tamayoko",Tamayoko,157.000₫,Đã bán 15,5.0,2.0,1,0,0,0,0,
https://tiki.vn/hop-chia-thuoc-7-ngay-hang-noi-dia-nhat-ban-p20476542.html?spid=56525177,Hộp Chia Thuốc 7 Ngày Hàng Nội Địa Nhật Bản,OEM,42.000₫,Đã bán 975,4.8,,132,16,4,0,0,
https://tiki.vn/ghe-xoay-van-phong-cong-thai-hoc-ergonomic-co-nga-lung-premium-02-ghe-xoay-gaming-cao-cap-nhap-khau-p146384829.html?spid=146384830,"Ghế xoay văn phòng công thái học ergonomic có ngả lưng Premium 02, ghế xoay Gaming cao cấp nhập khẩu",OEM,1.299.000₫,Đã bán 1316,4.7,4.0,278,68,12,2,3,
https://tiki.vn/ghe-phong-an-cabin-go-p25047946.html?spid=195237592,Ghế phòng ăn cabin gỗ,OEM,260.000₫,Đã bán 13,,,,,,,,
https://tiki.vn/gia-de-giay-ke-giay-ke-giay-dep-tu-giay-go-5-tang-p109358289.html?spid=184791828,"Giá để giày, Kệ Giày, kệ giầy dép - Tủ giày gỗ 5 tầng",OEM,154.996₫,Đã bán 155,4.6,,23,7,1,1,0,
https://tiki.vn/ban-hoc-iga-ban-lam-viec-go-decor-phong-cach-gaming-tre-trung-gm62-p181410158.html?spid=181410162,Bàn Làm Việc Đa Năng Decor Phong Cách Gaming Thương Hiệu IGA - GM62,IGA,388.240₫,Đã bán 861,4.6,1.0,150,47,2,2,7,
https://tiki.vn/ergonomic-footrest-ghe-gac-chan-cong-thai-hoc-thuong-hieu-iga-gn62-p255352689.html?spid=255352693,Ergonomic Footrest Ghế gác chân công thái học thương hiệu IGA - GN62,IGA,245.640₫,Đã bán 50,5.0,1.0,2,0,0,0,0,
https://tiki.vn/ke-de-dien-thoai-p271887126.html?spid=271887127,Kệ để điện thoại,OEM,1.000₫,Đã bán 38,,,,,,,,
https://tiki.vn/ghe-xoay-van-phong-lam-viec-cong-thai-hoc-deli-tay-gap-thong-minh-co-nga-lung-luoi-thoang-khi-chan-xoay-tien-ich-dem-ghe-em-ai-phu-hop-hoc-sinh-van-phong-game-thu-gaming-hang-chinh-hang-e4928-e4929-e4925-e4926g-p173211404.html?spid=173211412,"Ghế Xoay Văn Phòng Ngồi Làm Việc Công Thái Học Deli - Tay Gập Thông Minh, Có Ngả Lưng, Lưới Thoáng Khí, Chân Xoay Tiện Ích, Đệm Ghế Êm Aí - Phù Hợp Học Sinh, Văn Phòng, Game Thủ, Gaming - Hàng Chính Hãng - E4928 / E4929 / E4925 / E4926G",Deli,1.978.200₫,Đã bán 2725,4.5,4.0,413,142,38,19,28,
https://tiki.vn/thanh-treo-rem-day-du-phu-kien-thanh-rem-cua-gom-bat-do-dau-chup-oc-vit-p186085673.html?spid=186085685,"Thanh treo rèm đầy đủ phụ kiện, thanh rèm cửa gồm bát đỡ, đầu chụp, ốc vít",OEM,127.400₫,Đã bán 579,4.7,5.0,64,19,2,1,0,
https://tiki.vn/rem-dan-cua-so-phong-ngu-trang-tri-decor-khong-can-khoan-nhieu-kich-thuoc-p196568810.html?spid=196568898,"Rèm Dán Cửa Sổ Phòng Ngủ-Trang Trí,Decor-Không Cần Khoan-Nhiều Kích Thước",MODERO,69.000₫,Đã bán 172,5.0,7.0,22,3,0,0,0,
https://tiki.vn/ghe-van-phong-ghe-xoay-ghe-hoc-sinh-nownow-knt-111-p53703801.html?spid=91935914,"Ghế văn phòng, ghế xoay, ghế học sinh nownow KNT-111",OEM,370.000₫,Đã bán 185,4.1,,17,7,0,0,5,
https://tiki.vn/ke-de-giay-dep-inox-5-tang-chinh-hang-amalife-gia-de-giay-inox-5-tang-chon-mau-p71111080.html?spid=271531445,"Kệ Để Giày Dép Inox 5 Tầng Chính Hãng Amalife, Giá Để Giày Inox 5 Tầng - Chọn Màu",Amalife,107.000₫,Đã bán 1369,4.7,7.0,244,62,5,4,6,
https://tiki.vn/hoa-toc-_ke-de-giay-dep-5-tang-bang-go-p249868460.html?spid=249868495,HỎA TỐC _Kệ để giày dép 5 tầng bằng gỗ,OEM,220.000₫,Đã bán 23,,,,,,,,
https://tiki.vn/ke-go-treo-tuong-trang-tri-nhieu-kich-thuoc-ke-trang-tri-anzzar-decor-phong-ngu-phong-khach-thanh-go-treo-tuong-mau-nau-socola-p199708120.html?spid=199708128,"Kệ gỗ treo tường trang trí nhiều kích thước, kệ trang trí Anzzar, decor phòng ngủ, phòng khách, thanh gỗ treo tường màu nâu socola",anzzar,123.500₫,Đã bán 220,4.8,4.0,14,3,0,0,0,
https://tiki.vn/ban-hoc-ban-lam-viec-gap-gon-hien-dai-thuong-hieu-iga-gp154-p125555122.html?spid=125555124,"Bàn Học, Bàn Làm Việc Gấp Gọn Hiện Đại Thương Hiệu IGA - GP154",IGA,157.320₫,Đã bán 676,4.3,1.0,87,14,8,4,10,
https://tiki.vn/tu-nhua-kata-5-tang-talopa-p138534630.html?spid=198224605,"Tủ nhựa KATA 5 tầng giá rẻ, chất lượng, chính hãng, nhiều màu sắc",Duy Tân,1.049.000₫,Đã bán 552,4.5,1.0,136,34,6,5,7,
https://tiki.vn/ke-sach-de-ban-gia-sach-thiet-ke-hien-dai-thuong-hieu-iga-gp157-p128969410.html?spid=128969412,"Kệ Sách Để Bàn, Giá Sách Thiết Kế Hiện Đại Thương Hiệu IGA - GP157",IGA,212.000₫,Đã bán 1330,4.7,1.0,286,58,9,5,9,
https://tiki.vn/ke-sach-go-de-ban-da-nang-co-hoc-de-do-thuong-hieu-iga-gp258-p254095315.html?spid=254095319,Kệ sách gỗ để bàn đa năng có hộc để đồ thương hiệu IGA - GP258,IGA,176.640₫,Đã bán 40,4.8,1.0,5,1,0,0,0,
https://tiki.vn/bo-2-thung-vai-hop-vai-dung-do-da-nang-mau-nau-kem-tang-kem-day-cot-toc-hop-vai-dung-quan-ao-2-size-dung-quan-ao-do-lot-giay-van-phong-pham-do-dung-ca-nhan-rat-tien-loi-bo-2-hop-vai-dung-do-vai-canvas-sieu-xinh-co-nap-day-tu-vai-dung-do-hop-cai-quai-xach-hop-vai-dung-do-tien-loi-thung-dung-quan-ao-da-nang-gap-gon-p82875291.html?spid=82875293,"Bộ 2 thùng vải, hộp vải đựng đồ đa năng -Màu Nâu Kem + Tặng kèm dây cột tóc- Hộp vải đựng quần áo 2 size đựng quần áo, đồ lót, giày, văn phòng phẩm, đồ dùng cá nhân rất tiện lợi-Bộ 2 hộp vải đựng đồ vải canvas siêu xinh có nắp đậy, tủ vải đựng đồ hộp cái quai xách, Hộp vải đựng đồ tiện lợi, thùng đựng quần áo đa năng gấp gọn",SOHOGO,109.000₫,Đã bán 871,4.6,4.0,101,23,6,2,4,
https://tiki.vn/ke-chu-z-gap-gon-4-tang-de-giay-dep-va-trang-tri-phong-khach-p204615637.html?spid=204615639,Kệ Chữ Z Gấp Gọn 4 Tầng Để Giày Dép và Trang Trí Phòng Khách,NAVIVU,119.000₫,Đã bán 122,4.6,,9,0,2,0,0,
https://tiki.vn/ke-de-giay-dep-bang-go-5-tang-gia-de-giay-dep-5-tang-p15171312.html?spid=51567215,"Kệ Để Giày Dép Bằng Gỗ 5 Tầng, Giá Để Giầy Dép 5 Tầng",OEM(Error),170.000₫,Đã bán 73,4.3,,7,6,2,0,0,
https://tiki.vn/tui-vai-da-nang-dung-do-quan-ao-chan-ga-goi-man-gau-bong-sach-vo-kheo-khoa-deli-hop-vai-dung-do-khung-thep-chiu-luc-cao-cap-nhieu-size-kich-co-lon-nho-p206473614.html?spid=206473635,"Túi Vải Đựng Quần Áo, Chăn Ga Gối Màn Gấu Bông, Sách Vở Khéo Khoá Deli - Hộp Vải Đựng Đồ Đa Năng Khung Thép Chịu Lực Cao Cấp - Nhiều Size Kích Cỡ Lớn Nhỏ",Deli,119.000₫,Đã bán 472,4.8,3.0,37,6,1,1,0,
https://tiki.vn/ghe-don-hop-vai-da-nang-vinavu-chat-lieu-vai-oxford-cao-cap-p181503592.html?spid=181503608,Ghế Đôn Hộp Vải Đa Năng VINAVU Chất Liệu Vải Oxford Cao Cấp,NAVIVU,175.000₫,Đã bán 175,4.8,,19,6,0,0,0,
https://tiki.vn/ke-giay-go-3-4-5-tang-thuong-hieu-iga-gp247-p208218743.html?spid=208218747,Kệ giày gỗ 3 4 5 tầng thương hiệu IGA GP247,IGA,196.880₫,Đã bán 116,5.0,1.0,17,2,0,0,0,
https://tiki.vn/tu-vai-dung-do-khung-thep-chiu-luc-tui-dung-chan-man-quan-ao-midoctor-tien-loi-giao-mau-ngau-nhien-p55875210.html?spid=55875211,"Tủ Vải Đựng Đồ Khung Thép Chịu Lực, Túi Đựng Chăn Màn Quần Áo miDoctor Tiện Lợi - Giao Màu Ngẫu Nhiên",miDoctor,81.000₫,Đã bán 4329,4.7,7.0,482,104,22,7,6,
https://tiki.vn/tu-do-da-nang-tatami-co-the-lam-giuong-tu-do-sieu-tiet-kiem-thuong-hieu-iga-gp182-183-p157255707.html?spid=157255709,"Tủ Đồ Đa Năng Tatami Có Thể Làm Giường, Tủ Đồ Siêu Tiết Kiệm Thương Hiệu IGA - Gp182/183",IGA,515.200₫,Đã bán 427,4.6,1.0,53,12,0,3,1,
https://tiki.vn/ke-sach-to-ong-igea-da-tang-convent-234f-gp100-p75659112.html?spid=75659118,Kệ Sách Tổ Ong IGEA Đa Tầng Convent 234F - GP100,IGA,224.480₫,Đã bán 5000+,4.6,1.0,931,212,53,15,36,
https://tiki.vn/giuong-ngu-pallet-pallet-lap-rap-giuong-ngu-gap-gon-du-moi-kich-thuoc-go-thong-nhap-khau-anh-tai-xuong-p196889160.html?spid=196889187,"GIƯỜNG NGỦ PALLET, PALLET LẮP RÁP, GIƯỜNG NGỦ GẤP GỌN ĐỦ MỌI KÍCH THƯỚC GỖ THÔNG NHẬP KHẨU(ẢNH TẠI XƯỞNG)",OEM,771.075₫,Đã bán 188,4.8,8.0,37,7,0,1,0,
https://tiki.vn/rem-ngan-lanh-dieu-hoa-gia-re-rem-chong-nang-cua-so-cua-chinh-p201549594.html?spid=270181893,"Rèm ngăn lạnh điều hòa giá rẻ, rèm chống nắng cửa sổ cửa chính",OEM,285.000₫,Đã bán 220,5.0,,33,5,0,0,0,
https://tiki.vn/ke-wifi-treo-tuong-2-tang-khong-can-khoan-de-dau-thu-ky-thuan-so-remote-dien-thoai-ig407-p169848307.html?spid=169848309,"Kệ Wifi Treo Tường 2 Tầng Không Cần Khoan Để Đầu Thu Kỹ Thuật Số, Remote, Điện Thoại - IG407",IGA,70.000₫,Đã bán 2173,4.6,,282,108,8,4,11,
https://tiki.vn/tua-lung-cong-thai-hoc-ema-cho-ghe-van-phong-o-to-chuan-cong-thai-hoc-thoai-mai-thoang-mat-p197822149.html?spid=197854246,"Tựa lưng công thái học EMA cho ghế văn phòng, ô tô - Chuẩn công thái học, thoái mái & thoáng mát",Ema,339.480₫,Đã bán 393,4.8,4.0,26,3,1,0,0,
https://tiki.vn/ke-chia-ngan-tu-da-nang-chia-ngan-vach-dung-khong-can-khoan-va-bat-vit-p263683026.html?spid=263683032,"Kệ chia ngăn tủ đa năng, chia ngăn vách đứng không cần khoan và bắt vít",OEM,98.000₫,Đã bán 25,5.0,,3,0,0,0,0,
https://tiki.vn/tui-hop-vai-luoi-dung-do-lot-tat-vo-nhieu-ngan-khay-xep-chia-o-dung-do-de-tu-quan-ao-tien-ich-p173717336.html?spid=201603143,"Túi Hộp Vải Lưới Đựng Đồ Lót, Tất Vớ Nhiều Ngăn - Khay Xếp Chia Ô Đựng Đồ Để Tủ Quần Áo Tiện Ích",OEM,64.000₫,Đã bán 243,4.7,1.0,10,4,0,0,0,
https://tiki.vn/ke-de-giay-dep-bang-go-p10073670.html?spid=121575990,Kệ để giày dép bằng gỗ,OEM,161.999₫,Đã bán 98,4.5,,21,10,2,0,1,
https://tiki.vn/ong-hit-thong-mui-2-dau-thai-herb-double-inhaler-thai-lan-p197405453.html?spid=197405454,Ống hít thông mũi 2 đầu Thai Herb Double Inhaler Thái Lan,OEM,39.000₫,Đã bán 85,5.0,,4,0,0,0,0,
https://tiki.vn/bo-2-hop-dung-do-chia-ngan-sap-xep-quan-ao-mai-anh-house-hop-dung-do-tien-ich-chat-lieu-cao-cap-phong-cach-nhat-ban-sang-trong-p155382183.html?spid=163726404,"Bộ 2 hộp đựng đồ chia ngăn sắp xếp quần áo Mai Anh House - hộp đựng đồ tiện ích, chất liệu cao cấp, phong cách Nhật Bản sang trọng",Mai Anh House,205.000₫,Đã bán 213,4.7,,22,6,2,0,0,
https://tiki.vn/tua-lung-ghe-van-phong-cong-thai-hoc-dem-tua-lung-van-phong-p199638326.html?spid=201127046,Tựa Lưng Ghế Văn Phòng Công Thái Học Đệm Tựa Lưng Văn Phòng,Office Chill,689.000₫,Đã bán 584,4.8,3.0,65,6,3,0,0,
https://tiki.vn/ke-sach-to-ong-da-tang-convent-234f-gp100-p84457702.html?spid=93950422,Kệ Sách Tổ Ong Đa Tầng Convent 234F - GP100,OEM,125.400₫,Đã bán 20,3.3,4.0,3,0,1,0,2,
https://tiki.vn/ban-tra-decor-phong-khach-da-nang-phong-cach-hien-dai-thuong-hieu-iga-gm108-p272556167.html?spid=272556168,Bàn trà decor phòng khách đa năng phong cách hiện đại thương hiệu IGA - GM108,IGA,166.520₫,Đã bán 6,5.0,1.0,1,0,0,0,0,
https://tiki.vn/ghe-xep-thu-gian-sumika-179a-p57335326.html?spid=57335327,"Ghế xếp thư giãn SUMIKA 179A - Khóa kim loại, khung thép tròn, tải trọng 200kg",Sumika,839.000₫,Đã bán 2121,4.6,6.0,584,151,39,13,17,
https://tiki.vn/ban-laptop-da-nang-ban-hoc-gap-gon-thong-minh-tuy-chinh-goc-do-co-khay-de-coc-chan-laptop-ipad-p144221883.html?spid=144221903,Bàn laptop đa năng Bàn học gấp gọn thông minh tùy chỉnh góc độ có khay để cốc chặn laptop ipad,OEM,369.000₫,Đã bán 25,,,,,,,,
https://tiki.vn/hop-dung-thuoc-cao-cap-da-nang-co-chia-ngan-tien-loi-mang-di-lam-di-du-lich-thiet-ke-sang-trong-nhieu-mau-p186262906.html?spid=186262918,"Hộp Đựng Thuốc Cao Cấp Đa Năng Có Chia Ngăn, Tiện Lợi Mang Đi Làm, Đi Du Lịch. Thiết Kế Sang Trọng, Nhiều Màu",OEM,98.000₫,Đã bán 159,4.8,2.0,21,2,0,1,0,
https://tiki.vn/tu-nhua-cao-cap-tabi-van-go-5-tang-p197676301.html?spid=138534585,"Tủ nhựa TABI Vân gỗ cao cấp, chất lượng, giá rẻ, nhiều mẫu mã chính hãng Nhựa Duy Tân",Duy Tân,1.259.000₫,Đã bán 370,4.8,1.0,115,15,0,0,4,
https://tiki.vn/mang-boc-nilon-da-nang-che-phu-ngan-bui-che-chan-son-son-noi-that-nilon-boc-hang-chan-son-oto-1-dau-dan-p171469246.html?spid=171469248,"Màng bọc nilon che bụi đa năng, che phủ, ngăn bụi, chống ẩm mốc, giữ mới, bảo vệ nội thất,che chắn sơn, sơn nội thất, nilon bọc hàng, chắn sơn oto, có 1 đầu dán",OEM,19.000₫,Đã bán 270,4.5,,6,3,0,1,0,
https://tiki.vn/ban-lam-viec-chan-gap-gon-100cm-nhieu-mau-sac-p72044284.html?spid=72044292,BÀN LÀM VIỆC CHÂN GẤP GỌN 100CM - Nhiều màu sắc,OEM,400.000₫,Đã bán 706,4.6,,171,38,12,1,7,
https://tiki.vn/hop-dung-do-da-nang-tui-vai-dung-quan-ao-chan-man-phong-cach-thuy-dien-sang-trong-lich-su-hang-chinh-hang-midoctor-p75340681.html?spid=75340683,"Hộp Đựng Đồ Đa Năng TD1 – Túi Vải Đựng Quần Áo Chăn Màn Phong Cách Thụy Điển Sang Trọng, Lịch Sự – Hàng Chính Hãng",miDoctor,74.000₫,Đã bán 5000+,4.8,7.0,605,106,10,4,1,
https://tiki.vn/hop-dung-thuoc-hop-chia-thuoc-7-ngay-thong-minh-p177343127.html?spid=204049629,"Hộp Đựng Thuốc, Hộp Chia Thuốc 7 Ngày Thông Minh",OEM,58.000₫,Đã bán 16,4.0,,0,3,0,0,0,
https://tiki.vn/ghe-bet-tua-lung-ghe-bet-tua-lung-thu-gian-ghe-bet-tua-lung-thu-gian-gap-gon-ghe-an-cho-nguoi-gia-ghe-gap-benh-nhan-p204249188.html?spid=268911693,"Ghế bệt tựa lưng, ghế bệt tựa lưng thư giãn, ghế bệt tựa lưng thư giãn gấp gọn, ghế ăn cho người già, ghế gấp bệnh nhân",OEM,440.000₫,Đã bán 74,5.0,,11,1,0,0,0,
https://tiki.vn/tui-dung-do-lot-treo-tu-2-mat-30-ngan-tiet-kiem-khong-gian-p194570336.html?spid=194570342,"Túi Đựng Đồ Lót Treo Tủ 2 Mặt, 30 Ngăn Tiết Kiệm Không Gian",NAVIVU,49.000₫,Đã bán 208,4.8,,20,6,0,0,0,
https://tiki.vn/ban-gap-gap-gon-ngoi-giuong-nhap-khau-co-khe-bo-ipad-va-khe-dung-coc-hop-but-xkzs-001-60x42x28cm-p124379052.html?spid=124379060,Bàn gấp gấp gọn ngồi giường nhập khẩu có khe bỏ ipad và khe đựng cốc/hộp bút XKZS-001 (60x42x28cm),OEM,270.000₫,Đã bán 128,4.5,,29,2,1,0,3,
https://tiki.vn/ron-chan-cua-legaxi-keo-do-cai-tien-ngan-bui-va-con-trung-25-35-45-60-110mm-p26350629.html?spid=26350639,Ron Dán Chân Cửa Legaxi Keo Đỏ Cải Tiến Ngăn Bụi và Côn Trùng 25 35 45 60 110mm,Legaxi,53.000₫,Đã bán 5000+,4.5,1.0,548,167,62,7,20,
https://tiki.vn/ke-wifi-treo-tuong-ke-de-dau-thu-2-tang-vhr45-bang-van-smartboard-mau-trang-sang-trong-khong-can-khoan-tuong-day-du-phu-kien-treo-kem-theo-tang-keo-dan-tuong-chuyen-dung-p155108657.html?spid=155108663,"Kệ WIFI treo tường, kệ để đầu thu 2 tầng VHR45 bằng VÁN SMARTBOARD màu trắng sang trọng không cần khoan tường - Đầy đủ phụ kiện treo kèm theo, tặng keo dán tường chuyên dụng",OEM,70.000₫,Đã bán 39,5.0,,10,0,0,0,0,
https://tiki.vn/ke-thanh-ngang-treo-tuong-ket-cau-giau-chan-kem-phu-kien-full-ke-trang-tri-do-decor-dai-60cm-den-1m-tido-p175175639.html?spid=175175661,Kệ Thanh Ngang Treo Tường Kết Cấu Giấu Chân - Kèm Phụ Kiện Full - Kệ trang trí đồ decor dài 60cm đến 1m TIDO,TIDO,64.000₫,Đã bán 9,5.0,2.0,1,0,0,0,0,
https://tiki.vn/ghe-van-phong-cong-thai-hoc-ergonomic-co-nga-lung-tanni-premium-03-ghe-xoay-van-phong-lam-viec-cao-cap-nhap-khau-p197725714.html?spid=197725716,"Ghế Văn Phòng Công Thái Học Ergonomic TANNI Premium 03, Ghế Xoay Văn Phòng Làm Việc Cao Cấp Nhập Khẩu",OEM,1.229.000₫,Đã bán 147,4.5,4.0,18,8,3,0,1,
https://tiki.vn/ghe-chong-gu-do-body-ghe-cong-thai-hoc-dieu-chinh-dang-ngoi-p270305915.html?spid=270305977,Ghế chống gù DO BODY - Ghế công thái học - Điều chỉnh dáng ngồi,OEM,116.000₫,Đã bán 19,,6.0,,,,,,
https://tiki.vn/ghe-xep-thu-gian-sumika-199-co-lan-tay-massage-khung-vuong-cao-cap-tai-trong-300kg-p70083074.html?spid=70083075,"Ghế xếp thư giãn SUMIKA 199 - có lăn tay massage, khung vuông cao cấp, tải trọng 300kg",Sumika,1.139.000₫,Đã bán 1294,4.6,6.0,346,90,12,8,8,
https://tiki.vn/ban-lam-viec-ban-hoc-chu-k-p131407951.html?spid=131407971,Bàn làm việc bàn hoc chữ k,OEM,376.200₫,Đã bán 1638,4.5,,350,101,21,12,24,
https://tiki.vn/ghe-xep-thu-gian-cao-cap-sumika-179-khoa-bang-kim-loai-vai-luoi-textilene-thoang-khi-tai-trong-300kg-co-khay-dung-ly-dung-cu-tien-loi-khung-ghe-bang-thep-khong-gi-de-chong-truot-p53972329.html?spid=53972330,"Ghế xếp thư giãn cao cấp SUMIKA 179 - Khóa bằng kim loại, vải lưới Textilene thoáng khí, tải trọng 300kg, có khay đựng ly, dụng cụ tiện lợi, khung ghế bằng thép không gỉ, đế chống trượt",Sumika,939.000₫,Đã bán 1099,4.6,6.0,284,75,16,7,7,
https://tiki.vn/ban-lam-viec-ban-may-tinh-hien-dai-thuong-hieu-iga-gp153-p128938736.html?spid=128938739,Bàn Làm Việc Bàn Máy Tính Hiện Đại Thương Hiệu IGA - GP153,IGA,222.000₫,Đã bán 396,4.5,1.0,88,26,2,3,6,
https://tiki.vn/combo-05-ke-de-giay-dep-tiet-kiem-dien-tich-thong-minh-p3765833.html?spid=4665161,Combo 05 kệ để giày dép tiết kiệm diện tích thông minh,OEM,33.000₫,Đã bán 391,4.3,,7,6,2,0,0,
https://tiki.vn/thung-nhua-dung-do-da-nang-hinh-xe-o-to-phoi-nhieu-mau-p89644998.html?spid=89645006,Thùng nhựa đựng đồ đa năng hình xe ô tô phối nhiều màu,OEM,159.000₫,Đã bán 555,4.8,,101,12,1,0,1,
https://tiki.vn/ke-de-man-hinh-may-tinh-decor-ban-lam-viec-go-mdf-phu-melamin-chong-xuoc-thuong-hieu-iga-ga28-p272227021.html?spid=272227023,Kệ để màn hình máy tính decor bàn làm việc gỗ MDF phủ melamin chống xước thương hiệu IGA - GA28,IGA,92.000₫,Đã bán 8,5.0,1.0,1,0,0,0,0,
https://tiki.vn/hop-nhua-dung-thuoc-cam-tay-mini-giu-thuoc-luon-kho-rao-tranh-am-uot-nho-gon-tien-loi-de-su-dung-p267258571.html?spid=72507443,"Hộp Nhựa Đựng Thuốc Cầm Tay Mini - Giữ Thuốc Luôn Khô Ráo Tránh Ẩm Ướt (Nhỏ Gọn, Tiện Lợi, Dễ Sử Dụng)",OEM,42.000₫,Đã bán 641,4.8,,69,12,0,1,0,
https://tiki.vn/ben-hoi-ong-hoi-pison-ghe-xoay-van-phong-ma-chrome-p142670514.html?spid=142670529,Ben hơi/ Ống hơi/ Pison ghế xoay văn phòng (mạ chrome),OEM,160.000₫,Đã bán 196,5.0,,27,0,0,0,1,
https://tiki.vn/rem-cua-chong-nang-polyester-cao-cap-mau-nau-ca-phe-p183530319.html?spid=183530323,Rèm cửa cản nắng polyester cao cấp màu xám môn,OEM,196.000₫,Đã bán 73,4.5,,2,2,0,0,0,
https://tiki.vn/ke-sach-to-ong-van-go-fivo-ma-fb01-da-nang-dung-de-lam-gia-sach-ke-giay-ke-tivi-tu-dau-giuong-hang-chinh-hang-p138336249.html?spid=138336253,"Kệ Sách Tổ Ong Vân Gỗ FIVO FB01, Có Tấm Lưng Dày Dặn, Đa Năng Dùng Để Làm Giá Sách, Kệ Giày, Kệ Tivi, Tủ Đầu Giường - Hàng Chính Hãng",SPEVI,244.000₫,Đã bán 361,4.7,,51,12,0,1,2,
https://tiki.vn/rem-treo-cua-mau-cay-xanh-va-long-chim-1x2-7m-2x2-7m-3x2-7m-p154463337.html?spid=154463426,"Rèm treo cửa mẫu cây xanh và lồng chim (1x2.7m, 2x2.7m, 3x2.7m)",OEM,495.000₫,Đã bán 18,4.0,,0,1,0,0,0,
https://tiki.vn/ghe-ke-chan-van-phong-gia-do-ke-de-gac-nang-ha-massage-tai-ban-lam-viec-hoc-tap-footrest-ergohome-cong-thai-hoc-p189596867.html?spid=189596868,"Kê chân văn phòng, giá đỡ, kệ để gác nâng hạ massage tại bàn làm việc, học tập FOOTREST Ergohome Công thái học",ERGOHOME,279.000₫,Đã bán 162,4.6,2.0,20,2,0,1,1,
https://tiki.vn/tang-den-hoc-gia-do-nguc-bo-ban-hoc-cho-be-tieu-hoc-e01-tang-giam-chieu-cao-ke-sach-dem-mong-p270273661.html?spid=270273665,"(Tặng đèn học + Giá đỡ ngực) Bộ bàn học cho bé tiểu học E01 tăng giảm chiều cao, kệ sách, đệm mông",OEM,1.200.000₫,Đã bán 11,5.0,3.0,2,0,0,0,0,
https://tiki.vn/ke-sach-hinh-cay-de-san-p199593599.html?spid=199593602,Kệ Sách Hình Cây Để Sàn,IGA,297.000₫,Đã bán 2289,4.5,1.0,301,65,25,12,21,
https://tiki.vn/ghe-van-phong-chan-quy-ghe-hop-lung-luoi-khung-thep-sieu-ben-tang-kem-tui-thom-lavender-p113060183.html?spid=113060187,Ghế văn phòng chân quỳ - Ghế họp lưng lưới khung thép siêu bền - Tặng kèm túi thơm Lavender,OEM,550.000₫,Đã bán 399,4.5,,62,22,4,0,4,
https://tiki.vn/muoi-cham-cheo-uot-tay-bac-p269983182.html?spid=269983183,Muối chẩm chéo ướt Tây Bắc,OEM,55.000₫,Đã bán 41,5.0,,2,0,0,0,0,
https://tiki.vn/dau-gio-con-o-singapore-xanh-trang-vang-chai-24ml-p197422201.html?spid=197422205,Dầu Gió Con Ó Singapore Xanh - Trắng - Vàng Chai 24ml,OEM,155.000₫,Đã bán 136,5.0,,15,2,0,0,0,
https://tiki.vn/ke-sach-go-5-tang-ke-go-goc-tuong-p146393765.html?spid=146393769,Kệ Sách Gỗ 5 Tầng - Kệ gỗ góc tường,OEM,125.000₫,Đã bán 146,4.6,,30,8,0,0,2,
https://tiki.vn/co-dai-86l-hop-nhua-dung-do-da-nang-co-nap-day-cao-cap-nhieu-kich-co-deli-co-the-thao-lap-tiet-kiem-khong-gian-vs483-vs484-vs485-vs486-vs487-vs488-p206502393.html?spid=206519050,[Có Cỡ Đại 86L] Hộp Nhựa Đựng Đồ Đa Năng Có Nắp Đậy Cao Cấp Nhiều Kích Cỡ Deli - Có Thể Tháo Lắp Tiết Kiệm Không Gian,Deli,263.000₫,Đã bán 542,5.0,3.0,52,6,0,0,0,
https://tiki.vn/ke-sach-3-4-5-tang-da-nang-decor-phong-cach-kieu-han-thuong-hieu-iga-gm06t-p261995591.html?spid=261995595,Kệ Sách 3 4 5 Tầng Đa Năng Decor Phong Cách Kiểu Hàn Thương Hiệu IGA - GM06T,IGA,272.320₫,Đã bán 33,4.5,1.0,1,1,0,0,0,
https://tiki.vn/dau-hit-xoang-mui-khun-prame-8ml-thai-lan-p197405455.html?spid=197405456,Dầu Hít Xoang Mũi Khun Prame 8ml Thái Lan,OEM,45.000₫,Đã bán 136,4.8,,9,2,0,0,0,
