Link,Name,Brand,Price,Sale,Stars,NumberOfCoupon,5 stars,4 stars,3 stars,2 stars,1 star,Reviews
https://tiki.vn/tu-quan-ao-tu-dung-quan-ao-vai-khung-thep-titan-chot-hop-kim-cao-cap-130x170x45cm-sieu-chiu-tai-bh-24-thang-p262513752.html?spid=271698735,"Tủ quần áo, tủ đựng quần áo vải khung thép titan chốt hợp kim cao cấp 130x170x45cm siêu chịu tải BH 24 tháng",OEM,600.000₫,Đã bán 18,4.7,,2,1,0,0,0,
https://tiki.vn/ghe-gac-chan-cong-thai-hoc-dieu-chinh-6-cap-do-chieu-cao-thich-hop-van-phong-lam-viec-hoc-tap-ghe-ke-chan-chinh-dang-ngoi-tot-cho-suc-khoe-cot-song-giam-dau-lung-bao-hanh-90-ngay-p270303853.html?spid=270303855,"Ghế Gác Chân Công Thái Học Điều Chỉnh 6 Cấp Độ Chiều Cao Thích Hợp Văn Phòng Làm Việc Học Tập, Ghế Kê Chân Chỉnh Dáng Ngồi Tốt Cho Sức Khỏe Cột Sống Giảm Đau Lưng Bảo Hành 90 Ngày",Office Chill,199.000₫,Đã bán 17,5.0,,4,0,0,0,0,
https://tiki.vn/hop-dung-my-pham-do-trang-diem-mohi-mt9-2-ngan-co-ke-tren-va-nap-day-hang-chinh-hang-p73755163.html?spid=73755169,"Hộp Đựng Mỹ Phẩm,Đồ Trang Điểm MOHI MT9 ,2 Ngăn Có Kệ Trên Và Nắp Đậy-Hàng Chính Hãng",MO hi,427.500₫,Đã bán 349,4.8,,72,11,1,1,1,
https://tiki.vn/rong-bien-kep-hat-dinh-duong-rong-bien-mix-hat-bo-sung-dinh-duong-tot-cho-suc-khoe-tim-mach-va-he-tieu-hoa-250g-500g-p248156127.html?spid=248156133,Rong Biển Kẹp Hạt dinh dưỡng- Rong Biển Mix Hạt Bổ Sung Dinh Dưỡng Tốt Cho Sức Khỏe Tim Mạch Và Hệ Tiêu Hóa 250g/500g,OEM,355.000₫,Đã bán 26,4.8,,5,1,0,0,0,
https://tiki.vn/combo-4-bo-guong-dan-tuong-30x30cm-p120338074.html?spid=120338083,Combo 4 Bộ Gương dán tường 30x30cm,fofaHome,118.750₫,Đã bán 116,3.6,6.0,6,4,1,1,3,
https://tiki.vn/tam-luoi-tua-lung-ghe-oto-van-phong-p17944643.html?spid=62841284,"Tấm Lưới Tựa Lưng Ghế Oto ,Văn Phòng",OEM,50.000₫,Đã bán 169,4.5,,23,5,3,0,1,
https://tiki.vn/ke-treo-tuong-thanh-ngang-trang-tri-mau-van-go-soi-don-gian-sib-decor-go-chong-am-25mm-ket-cau-khong-gia-do-chac-chan-tham-my-p118090738.html?spid=118090742,"Kệ Treo Tường - Thanh Ngang Trang Trí Màu Vân Gỗ Sồi Đơn Giản SIB Decor, Gỗ Chống Ẩm 25mm, Kết Cấu Không Giá Đỡ Chắc Chắn Thẩm Mỹ",SIB DECOR,169.000₫,Đã bán 353,5.0,2.0,68,8,0,0,0,
https://tiki.vn/ngan-keo-nhua-nho-mini-khay-dung-but-gan-hop-ngan-keo-treo-duoi-ban-lam-viec-giup-cat-giu-gon-gang-ban-lam-viec-giao-mau-ngau-nhien-p155114109.html?spid=155114110,"Ngăn Kéo Nhựa Nhỏ Mini, Khay Đựng Bút Gắn, Hộp ngăn kéo Treo Dưới Bàn Làm Việc Giúp Cất Giữ Gọn Gàng Bàn Làm Việc (Giao Màu Ngẫu Nhiên)",OEM,155.000₫,Đã bán 327,4.7,3.0,43,7,2,1,0,
https://tiki.vn/thanh-treo-rem-cua-da-nang-khong-can-khoan-tuong-hay-bat-vit-thay-doi-vi-tri-linh-hoat-p101870479.html?spid=101870483,"Thanh treo rèm cửa đa năng, không cần khoan tường hay bắt vít, thay đổi vị trí linh hoạt",PEAFLO,79.000₫,Đã bán 398,4.5,6.0,49,10,2,1,4,
https://tiki.vn/ke-giay-chu-l-4-tang-da-nang-de-giay-dep-va-co-moc-treo-quan-ao-vua-tien-loi-vua-sang-trong-decor-phong-cach-vintage-hang-chinh-hang-miniin-p247304469.html?spid=247304470,Kệ Giày Chữ L 4 Tầng Đa Năng Để Giày Dép Và Có Móc Treo Quần Áo Vừa Tiện Lợi Vừa Sang Trọng Decor Phong Cách Vintage - Hàng Chính Hãng MINIIN,MINIIN,159.000₫,Đã bán 18,3.0,1.0,1,0,0,0,1,
https://tiki.vn/ghe-xep-thu-gian-tang-kem-dem-va-khay-dung-ly-cao-cap-ghe-ngu-trua-van-phong-p56574568.html?spid=182841290,"Ghế Xếp Thư Giãn Tặng Kèm Đệm Và Khay Đựng Ly Cao Cấp, Ghế Ngủ Trưa Văn Phòng",OEM,998.999₫,Đã bán 40,5.0,2.0,4,0,0,0,0,
https://tiki.vn/tu-y-te-gia-dinh-treo-tuong-size-35-x-28-x-15cm-p45825289.html?spid=45825290,Tủ Y Tế Gia Đình Treo Tường size 35 x 28 x 15cm,OEM,340.000₫,Đã bán 149,4.3,,16,11,2,0,2,
https://tiki.vn/ke-de-giay-dep-5-tang-bang-go-cao-cap-ke-duoc-thiet-ke-5-tang-de-giay-dep-ngan-keo-dung-do-kt-ke-5-tang-83-x-24-x-60-p136874704.html?spid=182298998,"Kệ để Giày Dép 5 Tầng Bằng Gỗ Cao Cấp/Kệ được Thiết Kế 5 Tầng để Giày Dép ,ngăn Kéo đựng đồ Kt Kệ 5 Tầng: 83 X 24 X 60",OEM,156.578₫,Đã bán 51,4.6,,7,4,0,0,0,
https://tiki.vn/ong-hit-thong-mui-2-dau-peppermint-field-inhaler-aromatics-thai-lan-p262053218.html?spid=197405449,Ống Hít Thông Mũi 2 Đầu PEPPERMINT FIELD Inhaler Aromatics Thái Lan,OEM,33.950₫,Đã bán 63,5.0,,2,0,0,0,0,
https://tiki.vn/hop-chia-thuoc-7-ngay-tien-dung-p88042657.html?spid=192930949,Hộp chia thuốc 7 ngày tiện dụng,OEM,86.888₫,Đã bán 32,5.0,,1,0,0,0,0,
https://tiki.vn/mxk5-30x20x10-cm-20-thung-hop-carton-p98323548.html?spid=98324148,MXK5 - 30x20x10 cm - 20 Thùng hộp carton,MAGIX,79.800₫,Đã bán 116,5.0,,5,0,0,0,0,
https://tiki.vn/bo-4-chan-ban-gap-gon-bang-sat-ma-kem-mau-trang-sang-chac-chan-dai-27cm-p122561225.html?spid=122561226,"Bộ 4 chân bàn gấp gọn bằng sắt mạ kẽm màu trắng sáng chắc chắn, dài 27cm",OEM,55.000₫,Đã bán 69,4.7,,7,3,0,0,0,
https://tiki.vn/giuong-xep-van-phong-ngu-trua-gap-gon-kich-thuoc-67x180cm-giuong-gap-gon-nghi-trua-tien-loi-cao-cap-p162142659.html?spid=162142660,"Giường xếp văn phòng ngủ trưa gấp gọn kích thước 67x180cm, giường gấp gọn nghỉ trưa tiện lợi cao cấp",OEM,559.000₫,Đã bán 26,4.3,4.0,1,2,0,0,0,
https://tiki.vn/ke-giay-dep-gia-de-giay-dep-4-tang-tien-dung-giao-mau-ngau-nhien-p51144810.html?spid=89588723,"Kệ giày dép, giá để giày dép 4 tầng tiện dụng - giao màu ngẫu nhiên",OEM,37.900₫,Đã bán 69,4.6,,6,1,1,0,0,
https://tiki.vn/ke-sach-de-ban-lam-viec-hoa-tiet-de-thuong-thuong-hieu-iga-ig410-p200720476.html?spid=200720477,Kệ Sách Để Bàn Làm Việc Họa Tiết Dễ Thương Thương Hiệu IGA - IG410,IGA,130.640₫,Đã bán 105,4.5,1.0,10,2,0,1,1,
https://tiki.vn/10-thung-hop-carton-ma-mhl8-kich-thuoc-50x40x30-cm-p98678067.html?spid=98678068,10 Thùng hộp carton - Mã MHL8 - Kích thước 50x40x30 (cm),MAGIX,162.000₫,Đã bán 709,4.8,,94,21,0,0,2,
https://tiki.vn/ket-sat-xiaomi-mijia-su-dung-van-tay-thong-minh-6-che-do-mo-khoa-ap-dung-cong-nghe-cao-bao-dong-ket-noi-app-thong-minh-hang-nhap-khau-p252386679.html?spid=185177414,"Két Sắt Thông Minh, Két Sắt Xiaomi Mijia Sử Dụng Vân Tay Gồm 6 Chế Độ Mở Khóa Áp Dụng Công Nghệ Cao Báo Động, Kết Nối App Thông Minh - Hàng Nhập Khẩu",Xiaomi,2.799.000₫,Đã bán 46,5.0,12.0,10,1,0,0,0,
https://tiki.vn/tu-giay-thong-minh-canh-lat-tu-giay-go-cat-giu-24-doi-giay-gp20-1-p115795356.html?spid=115795358,"Tủ Giày Thông Minh Cánh Lật, Tủ Giày Gỗ Cất Giữ 24 Đôi Giầy GP20.1",OEM,850.000₫,Đã bán 236,4.5,2.0,53,12,6,1,2,
https://tiki.vn/ghe-nhua-xep-cao-duy-tan-no-943-xep-gon-da-nang-mang-theo-de-dang-p32924508.html?spid=32924509,Ghế nhựa xếp cao Duy Tân No.943 Xếp gọn đa năng mang theo dễ dàng,Duy Tân,95.000₫,Đã bán 188,4.8,,11,2,0,0,0,
https://tiki.vn/guong-soi-toan-than-dan-tuong-p56275200.html?spid=194201050,GƯƠNG SOI TOÀN THÂN DÁN TƯỜNG,OEM,113.050₫,Đã bán 35,4.3,4.0,1,2,0,0,0,
https://tiki.vn/ban-an-thong-minh-go-soi-tu-nhien-bo-4-ghe-p132005132.html?spid=132005207,Bàn Ăn Thông Minh Gỗ Sồi Tự Nhiên ( Bộ 4 Ghế ),OEM,3.990.000₫,Đã bán 21,4.0,2.0,3,1,1,1,0,
https://tiki.vn/dau-lan-thai-lan-chai-8ml-huong-gung-sa-huong-sa-huong-lavender-p262045835.html?spid=262045839,"Dầu Lăn Thái Lan Chai 8ml , Hương Gừng Sả , Hương Sả , Hương Lavender",OEM,35.000₫,Đã bán 39,4.0,,0,1,0,0,0,
https://tiki.vn/ghe-nhua-cafe-van-phong-chan-go-nhap-khau-eames-du-mau-p132005281.html?spid=132005318,Ghế nhựa Cafe - Văn Phòng chân gỗ nhập khẩu EAMES Đủ Màu,OEM,229.000₫,Đã bán 138,4.5,,24,4,3,1,1,
https://tiki.vn/ke-go-treo-tuong-ke-go-trang-tri-anzzar-nhieu-kich-thuoc-p107398992.html?spid=107398996,"Kệ gỗ treo tường, kệ gỗ trang trí Anzzar nhiều kích thước",anzzar,80.000₫,Đã bán 506,4.7,4.0,55,17,2,1,0,
https://tiki.vn/ghe-xoay-van-phong-cong-thai-hoc-ergonomic-co-gac-chan-va-nga-lung-sau-premium-g1-ghe-xoay-gaming-cao-cap-nhap-khau-p261958711.html?spid=261958715,"Ghế Xoay Văn Phòng Công Thái Học Ergonomic Có Gác Chân Và Ngả Lưng Sâu Premium G1 , Ghế Xoay Gaming Cao Cấp Nhập Khẩu",TANNI,1.380.000₫,Đã bán 30,4.8,4.0,8,2,0,0,0,
https://tiki.vn/ghe-xep-thu-gian-van-phong-chinh-hang-nikita-2036-p76067266.html?spid=95468894,Ghế xếp thư giãn văn phòng - chính hãng NIKITA 2036,Nikita,1.089.000₫,Đã bán 57,4.8,6.0,15,1,1,0,0,
https://tiki.vn/bo-gia-do-ke-ban-gap-treo-tuong-kunbe-ban-le-gap-thong-minh-tiet-kiem-khong-gian-chiu-tai-tot-p145750524.html?spid=145750532,"Bộ Giá Đỡ Ke Bàn Gấp Treo Tường KUNBE, Bản Lề Gập Thông Minh Tiết Kiệm Không Gian, Chịu Tải Tốt",KUNBE,115.000₫,Đã bán 291,4.8,,41,11,1,0,0,
https://tiki.vn/rem-ngan-lanh-dieu-hoa-gia-re-rem-can-sang-cua-so-cua-chinh-vai-xam-bo-day-dan-nhieu-kich-thuoc-p202717594.html?spid=202717603,"Rèm ngăn lạnh điều hòa giá rẻ, rèm cản sáng cửa sổ cửa chính vải dày dặn nhiều kích thước",OEM,68.000₫,Đã bán 23,,5.0,,,,,,
https://tiki.vn/ghe-chinh-dang-ngoi-dung-roichen-han-quoc-made-in-korea-dung-cho-nam-nu-tre-em-hang-chinh-hang-p164479566.html?spid=262692784,"Ghế chỉnh dáng ngồi đúng - Roichen Hàn Quốc (Made in Korea). Dùng cho Nam, Nữ, Trẻ em. Hàng chính hãng",Roichen,1.310.000₫,Đã bán 1032,4.8,,202,43,6,1,1,
https://tiki.vn/bo-4-bit-goc-ban-bang-nhua-tranh-va-cham-goc-ban-an-toan-tre-em-p263798904.html?spid=263798905,"Bộ 4 bịt góc bàn bằng nhựa - Tránh va chạm góc bàn, an toàn trẻ em",TIDO noithatTIDO.vn,11.000₫,Đã bán 79,,,,,,,,
https://tiki.vn/ben-hoi-ghe-xoay-van-phong-nhan-vien-giam-doc-ghe-game-bar-p139741615.html?spid=139741630,"Ben Hơi Ghế Xoay Văn Phòng, Nhân Viên, Giám Đốc, Ghế Game, Bar",OEM,120.000₫,Đã bán 60,4.7,1.0,9,2,1,0,0,
https://tiki.vn/thung-luu-tru-da-nang-matsu-lock-15l-thung-nhua-dung-do-thung-dung-do-thiet-ke-hop-co-khoa-cai-then-chong-xep-de-dang-nhieu-mau-lua-chon-p270299275.html?spid=270299285,"Thùng lưu trữ đa năng Matsu Lock 15L, thùng nhựa đựng đồ, thùng đựng đồ thiết kế hộp có khóa cài then, chồng xếp dễ dàng, nhiều màu lựa chọn",Duy Tân,99.000₫,Đã bán 23,,,,,,,,
https://tiki.vn/hop-dung-bong-tay-trang-tam-bong-trong-suot-p142801302.html?spid=142801343,"Hộp đựng bông tẩy trang, tăm bông trong suốt",OEM,55.000₫,Đã bán 35,5.0,,2,0,0,0,0,
https://tiki.vn/hop-nhua-dung-do-co-nap-khay-nhua-dung-do-co-nap-kem-tay-cam-tien-loi-p196409762.html?spid=196409764,"Hộp nhựa đựng đồ có nắp, khay nhựa đựng đồ có nắp kèm tay cầm tiện lợi",OEM,107.000₫,Đã bán 60,4.5,,6,0,0,0,1,
https://tiki.vn/ke-sach-dung-go-mdf-fivo-fb70-80-x-24-x-178cm-6-tang-chia-nhieu-ngan-hang-chinh-hang-p192116446.html?spid=192116448,Kệ Sách Đứng Gỗ MDF FIVO FB70 (80 x 24 x 178cm) 6 Tầng Chia Nhiều Ngăn (Có Tấm Lưng Phía Sau) - Hàng Chính Hãng,FIVO,1.338.000₫,Đã bán 143,5.0,5.0,34,3,1,0,0,
https://tiki.vn/tu-tabi-diamond-l-5-ngan-sang-trong-tien-loi-p272616443.html?spid=272616445,"Tủ Tabi Diamond-L 5 ngăn, tủ nhựa Duy Tân cao cấp, sang trọng, tủ quần áo đa năng, tiện lợi",Duy Tân,1.605.000₫,Đã bán 7,5.0,1.0,2,0,0,0,0,
https://tiki.vn/ban-hoc-ban-lam-viec-gaming-chan-chu-k-cao-cap-day-du-phu-kien-ban-gaming-chan-double-x-thiet-ke-hien-dai-kien-co-vung-chac-2-mau-trang-va-den-p272209511.html?spid=272209519,"Bàn học, bàn làm việc Gaming chân chữ K cao cấp đầy đủ phụ kiện, Bàn Gaming chân Double X thiết kế hiện đại kiên cố vững chắc 2 màu trắng và đen",Nội Thất 5C,787.000₫,Đã bán 10,,4.0,,,,,,
https://tiki.vn/ban-lam-viec-co-ke-sach-mau-moi-p44803282.html?spid=67807996,Bàn Làm Việc Có Kệ Sách Mẫu Mới,OEM,231.000₫,Đã bán 909,4.5,,221,67,17,3,9,
https://tiki.vn/ghe-bet-tua-lung-ghe-luoi-bang-go-vimos-tang-kem-day-keo-tap-the-duc-mau-ngau-nhien-p72927372.html?spid=77661721,"Ghế bệt tựa lưng, ghế lười bằng gỗ VIMOS -Tặng kèm dây kéo tập thể dục( màu ngẫu nhiên)",VIMOS,330.000₫,Đã bán 212,4.5,,58,10,2,2,5,
https://tiki.vn/combo-10_20_30_40_50-cai-bat-tam-giac-bat-ke-sat-v-lo-da-nang-p167011834.html?spid=167011846,Combo ( 10_20_30_40_50 cái ) Bát tam giác bắt kệ sắt V lỗ đa năng,OEM,30.000₫,Đã bán 39,4.2,,2,2,1,0,0,
https://tiki.vn/thanh-treo-rem-cua-bang-go-cam-xe-cay-phi-30-du-phu-kien-di-kem-p134795079.html?spid=134795230,"Thanh Treo Rèm Cửa Bằng Gỗ Căm Xe, Cây Phi 30 Đủ Phụ Kiện Đi Kèm",OEM,399.000₫,Đã bán 6,5.0,,1,0,0,0,0,
https://tiki.vn/hop-nhua-dung-do-da-nang-co-banh-xe-di-chuyen-co-khop-de-xep-chong-len-nhau-tiet-kiem-khong-gian-nikita-2023-p207341199.html?spid=207957116,Hộp nhựa đựng đồ đa năng - Có bánh xe di chuyển - Có khớp để xếp chồng lên nhau tiết kiệm không gian - NIKITA 2023,Nikita,219.000₫,Đã bán 190,5.0,5.0,19,3,0,0,0,
https://tiki.vn/ban-xep-gap-gon-thong-minh-phb609-ban-lam-viec-va-hoc-tap-4-cap-do-da-nang-pehouse-p192951644.html?spid=192951648,Bàn Xếp Gấp Gọn Thông Minh PHB609 Bàn Làm Việc Và Học Tập 4 Cấp Độ Đa Năng Pehouse,pehouse,1.199.000₫,Đã bán 171,4.5,2.0,25,2,1,0,4,
https://tiki.vn/thung-nhua-dung-do-da-nang-bestlock-p6775905.html?spid=27565459,Thùng nhựa đựng đồ Đa Năng Bestlock,Bestlock,260.000₫,Đã bán 609,4.5,,35,11,3,2,1,
https://tiki.vn/ke-man-hinh-de-ban-lam-viec-don-gian-sib-decor-p174609283.html?spid=174609289,Kệ Màn Hình Để Bàn Làm Việc Đơn Giản SIB Decor,SIB DECOR,150.000₫,Đã bán 279,4.8,2.0,58,7,1,1,0,
https://tiki.vn/ghe-cong-thai-hoc-chong-gu-dieu-chinh-tu-the-tre-em-hoc-sinh-sinh-vien-van-phong-legaxi-p248592399.html?spid=248592407,"Ghế Công Thái Học Chống Gù, Điều Chỉnh Tư Thế Trẻ Em, Học SInh, Sinh Viên, Văn Phòng Legaxi",Legaxi,132.000₫,Đã bán 24,5.0,1.0,1,0,0,0,0,
https://tiki.vn/hop-dung-giay-xin-nap-mo-nam-cham-tu-dong-chat-lieu-nhua-cung-100-thao-lap-de-dang-chiu-luc-10kg-p213887601.html?spid=213887603,Hộp Đựng Giày Xịn Nắp Mở Nam Châm Tự Động Chất Liệu Nhựa Cứng 100% Tháo Lắp Dễ Dàng Chịu Lực 10Kg,OEM,69.000₫,Đã bán 148,4.5,1.0,2,3,0,0,0,
https://tiki.vn/10-thung-hop-carton-ma-mhl4-kich-thuoc-40x30x20-cm-p83398188.html?spid=83398190,10 Thùng hộp carton - Mã MHL4 - Kích thước 40x30x20 (cm),MAGIX,97.000₫,Đã bán 252,4.8,,31,6,0,1,0,
https://tiki.vn/thung-nhua-dung-do-gap-gon-vo-cung-tien-dung-p50563525.html?spid=139742002,Thùng Nhựa Đựng Đồ - Gấp Gọn Vô Cùng Tiện Dụng,OEM,146.000₫,Đã bán 18,4.0,,1,1,1,0,0,
https://tiki.vn/combo-ban-ghe-bo-ban-hoc-sinh-tre-em-ban-hoc-cho-be-lop-1-kieu-hoat-hinh-ban-hoc-gap-gon-m057-p198901471.html?spid=198901479,"[Combo Bàn+Ghế] Bộ Bàn Học Sinh Trẻ Em, Bàn Học Cho Bé Lớp 1 Kiểu Hoạt Hình, Bàn Học Gấp Gọn -M057",OEM,620.000₫,Đã bán 5,5.0,,1,0,0,0,0,
https://tiki.vn/ban-xep-gap-gon-da-nang-go-co-tay-cam-ban-lam-viec-ban-an-de-laptop-ban-van-phong-go-cao-su-chac-chan-ben-bi-p253119146.html?spid=253119150,"Bàn Xếp Gấp Gọn Đa Năng Gỗ Có Tay Cầm Bàn Làm Việc, Bàn Ăn, Để Laptop, Bàn Văn Phòng - Gỗ Cao Su Chắc Chắn Bền Bỉ",OEM,180.000₫,Đã bán 25,5.0,,4,0,0,0,0,
https://tiki.vn/rem-cua-dan-tuong-man-cua-chong-nang-may-san-chat-lieu-vai-cao-cap-rem-cua-digahome-p24-p196565418.html?spid=221269443,"Rèm Cửa Dán Tường, màn chống nắng may sẵn Chất Liệu Vải Cao Cấp",MODERO,97.000₫,Đã bán 179,4.8,7.0,22,5,0,0,0,
https://tiki.vn/combo-5-ke-de-giay-dep-thong-minh-tiet-kiem-khong-gian-cao-cap-hang-vnclc-p22023394.html?spid=22023395,Combo 5 Kệ Để Giày Dép Thông Minh Tiết Kiệm Không Gian Cao Cấp Hàng VNCLC,OEM,107.400₫,Đã bán 115,4.7,,5,2,0,0,0,
https://tiki.vn/tu-nhua-6-o-khung-trang-cua-trang-decal-quan-ao-1-thanh-treo-p35617127.html?spid=117894253,"Tủ Nhựa 6 ô - Khung Trắng , Cửa Trắng , Decal Quần Áo 1 Thanh Treo",OEM,289.000₫,Đã bán 29,4.5,4.0,2,2,0,0,0,
https://tiki.vn/hop-nhua-dung-do-co-nap-ma-u-nga-u-nhien-p68786545.html?spid=68786546,Hộp nhựa đựng đồ có nắp - màu ngẫu nhiên,OEM,85.000₫,Đã bán 205,4.2,,14,4,2,1,2,
https://tiki.vn/rem-cua-so-phong-khach-phong-ngu-mau-xam-nhat-sang-trong-p201632468.html?spid=201632500,"Rèm cửa sổ phòng khách, phòng ngủ màu xám nhạt sang trọng",OEM,279.000₫,Đã bán 104,4.3,5.0,8,6,0,0,1,
https://tiki.vn/ban-hoc-go-gap-gon-ban-go-co-khe-cam-giao-mau-ngau-nhien-p52577179.html?spid=73416111,"Bàn học gỗ gấp gọn,Bàn gỗ có khe cắm(Giao màu ngẫu nhiên)",OEM,137.750₫,Đã bán 143,4.2,,25,8,2,3,3,
https://tiki.vn/hop-vai-dung-tat-vo-sethome-gio-vai-dung-ao-lot-do-lot-quan-ao-ngu-vay-ngu-gap-gon-p167445803.html?spid=167445805,Hộp vải đựng tất vớ SETHOME giỏ vải đựng áo lót đồ lót quần áo ngủ váy ngủ gấp gọn,Sethome,249.000₫,Đã bán 29,4.7,,4,2,0,0,0,
https://tiki.vn/mat-ban-go-cao-su-phu-bong-2-mat-bo-tron-goc-p116192142.html?spid=154293094,MẶT BÀN GỖ CAO SU PHỦ BÓNG 2 MẶT BO TRÒN GÓC.,OEM,127.300₫,Đã bán 5,,,,,,,,
https://tiki.vn/rem-cua-dan-hai-lop-mau-ngoi-sao-sang-nhieu-mau-nhieu-size-p262086490.html?spid=262086572,Rèm cửa dán hai lớp mẫu ngôi sao sáng (nhiều màu nhiều size),OEM,189.000₫,Đã bán 5,,,,,,,,
https://tiki.vn/ghe-tay-vin-in-thu-ban-ghe-tre-em-bang-go-p133811874.html?spid=133811877,"Ghế tay vịn in thú | Bàn ghế trẻ em bằng gỗ, ghế dựa trẻ em an toàn cho trẻ mới biết đi, ghế ngồi ăn và chơi cho bé",OEM,243.000₫,Đã bán 8,,2.0,,,,,,
https://tiki.vn/ke-but-de-ban-ke-ho-so-dung-cu-van-phong-ke-dien-thoai-may-tinh-ke-de-ban-lam-viec-da-nang-bang-go-tang-kem-1-moc-khoa-khung-hinh-thoi-trang-p73515653.html?spid=117408170,"Kệ bút để bàn, kệ hồ sơ dụng cụ văn phòng, kệ điện thoại máy tính, kệ để bàn làm việc đa năng bằng gỗ - Tặng kèm 1 móc khóa khung hình thời trang",OEM,95.000₫,Đã bán 7,5.0,,2,0,0,0,0,
https://tiki.vn/hop-dung-do-lon-bang-nhua-trong-suot-co-nap-keo-p225942799.html?spid=226166496,"Hộp Đựng Đồ Lớn, Tủ Đựng Đồ 2 Cửa Đựng Quần Áo Sách Đồ Chơi Đa Năng Trong Suốt Nhựa Gấp Gọn (45L & 95L)",VANDO,551.080₫,Đã bán 121,4.0,3.0,3,2,0,0,1,
https://tiki.vn/ghe-xoay-van-phong-ghe-van-phong-ad010-p204046604.html?spid=204046605,"Ghế xoay văn phòng,ghế văn phòng AD010",Ánh Dương,381.150₫,Đã bán 70,4.5,,5,2,1,0,0,
https://tiki.vn/tu-de-do-thong-minh-s-smart-tan-dung-khong-gian-canh-cua-so-gp131-p113458874.html?spid=113458876,Tủ Để Đồ Thông Minh S Smart Tận Dụng Không Gian Cạnh Cửa Sổ - GP131,IGA,522.560₫,Đã bán 1700,4.5,1.0,335,72,23,7,25,
https://tiki.vn/gia-sach-go-kiem-decor-chu-u-topv-ke-sach-de-ban-treo-tuong-de-dung-do-ke-vo-cho-be-nho-mini-gia-re-p194798321.html?spid=194798347,Giá sách gỗ kiêm decor chữ U TopV kệ sách để bàn treo tường để đựng đỡ kê vở cho bé nhỏ mini giá rẻ,OEM,69.000₫,Đã bán 95,4.5,,8,1,0,0,1,
https://tiki.vn/guong-dan-tuong-30x30cm-loai-moi-p252390050.html?spid=252390053,Gương dán tường 30x30cm LOẠI MỚI,OEM,44.000₫,Đã bán 993,3.9,4.0,28,10,2,1,10,
https://tiki.vn/combo-2-hop-chia-ngan-sap-xep-quan-ao-phong-cach-nhat-ban-vinavu-p163827070.html?spid=163827081,Combo 2 hộp chia ngăn sắp xếp quần áo phong cách Nhật Bản VINAVU,OEM,210.000₫,Đã bán 247,4.5,,19,5,0,0,3,
https://tiki.vn/ke-giay-thong-minh-tu-giay-go-da-nang-4-tang-canh-tu-trang-hai-ben-kem-ke-phong-cach-hien-dai-78x30x78-tago-nd22-p191911126.html?spid=204337306,"Kệ giày thông minh, tủ giày gỗ đa năng 4 tầng cánh tủ trắng, hai bên kèm kệ phong cách hiện đại 78x30x78 TAGO ND22",OEM,284.999₫,Đã bán 50,4.5,,4,1,1,0,0,
https://tiki.vn/hop-vai-dung-do-chia-ngan-hq4-hop-dung-quan-ao-chia-9-ngan-12-ngan-gap-gon-chinh-hang-midoctor-p201572327.html?spid=201572333,"Hộp vải đựng đồ chia ngăn HQ4 - Hộp đựng quần áo chia 9 ngăn, 12 ngăn gấp gọn chính hãng",miDoctor,95.000₫,Đã bán 141,4.8,7.0,11,3,0,0,0,
https://tiki.vn/hop-dung-quan-ao-chia-9-ngan-mau-ke-caro-co-nap-day-trong-suot-tien-loi-p227310338.html?spid=227310342,HỘP ĐỰNG QUẦN ÁO CHIA 9 NGĂN MẪU KẺ CARO CÓ NẮP ĐẬY TRONG SUỐT TIỆN LỢI,OEM,59.000₫,Đã bán 28,5.0,,1,0,0,0,0,
https://tiki.vn/ban-lam-viec-lien-gia-sach-blv20-100x50xcao75cm-full-phu-kien-oc-vit-p204046764.html?spid=204046811,Bàn làm việc liền giá sách BLV20 100x50xCao75cm( full phụ kiện ốc vít),Ánh Dương,479.200₫,Đã bán 49,4.7,,13,0,0,0,1,
https://tiki.vn/ke-go-de-man-hinh-ban-lam-viec-2-tang-sib-decor-p183503039.html?spid=183503045,Kệ Gỗ Để Màn Hình Bàn Làm Việc 2 Tầng SIB Decor,SIB DECOR,245.000₫,Đã bán 63,4.7,2.0,12,3,1,0,0,
https://tiki.vn/guong-tron-treo-tuong-go-anfurniture-size-50cm-p72467949.html?spid=91337459,Gương Tròn Treo Tường Gỗ Anfurniture-size 50cm,OEM,170.000₫,Đã bán 508,4.7,,97,16,3,3,1,
https://tiki.vn/hop-dung-do-vai-oxford-quai-sat-khung-cung-chac-chan-ma-p55245904.html?spid=159846853,"Hộp đựng đồ vải Oxford quai inox sáng bóng, khung cứng chắc chắn, bền đẹp, không xù không bai dão MA",Mai Anh House,180.000₫,Đã bán 163,5.0,,19,1,0,0,0,
https://tiki.vn/ban-hoc-lam-viec-gap-gon-da-nang-thong-minh-phu-hop-voi-moi-khong-gian-co-khe-cam-ipad-dien-thoai-hang-chinh-hang-miniin-p129271226.html?spid=129271228,"Bàn Học, Làm Việc Gấp Gọn Đa Năng Thông Minh Phù Hợp Với Mọi Không Gian Có Khe Cắm Ipad, Điện Thoại- Hàng Chính Hãng MINIIN",MINIIN,97.200₫,Đã bán 100,3.9,1.0,14,5,3,2,3,
https://tiki.vn/gia-de-giay-ke-giay-ke-giay-dep-tu-giay-go-5-tang-p16447290.html?spid=50405777,"Giá để giày, Kệ Giày, kệ giầy dép - Tủ giày gỗ 5 tầng",OEM,160.932₫,Đã bán 227,4.1,,36,18,6,2,6,
https://tiki.vn/hong-say-deo-da-lat-tui-500g-p271665269.html?spid=271665270,Hồng sấy dẻo đà lạt túi 500g,OEM,150.000₫,Đã bán 8,,1.0,,,,,,
https://tiki.vn/ke-sach-go-de-ban-tu-ke-sach-mini-giao-mau-sac-ngau-nhien-p50241058.html?spid=59450774,"Kệ sách gỗ để bàn - Tủ,kệ sách mini - Giao màu sắc ngẫu nhiên",OEM,84.000₫,Đã bán 539,4.5,5.0,85,27,9,3,5,
https://tiki.vn/bo-2-chiec-hop-vai-dung-do-thuy-dien-24l-combo-2-chiec-tui-vai-da-nang-td1-co-chon-mau-midoctor-p161236346.html?spid=161236350,"Bộ 2 chiếc hộp vải đựng đồ Thụy Điển 24L, Combo 2 chiếc túi vải đa năng TD1 có chọn màu miDoctor",miDoctor,149.000₫,Đã bán 187,4.8,7.0,37,8,0,0,0,
https://tiki.vn/ke-sach-da-tang-de-san-p22372768.html?spid=22372772,Kệ Sách Đa Tầng Để Sàn,IGA,486.680₫,Đã bán 5000+,4.6,1.0,2148,488,96,38,60,
https://tiki.vn/ghe-cong-thai-hoc-ergonomic-co-nga-lung-gac-chan-tanni-premium-02-plus-ghe-xoay-van-phong-gaming-cao-cap-nhap-khau-p204057050.html?spid=204057054,"Ghế Công Thái Học Ergonomic Có Ngả Lưng Gác Chân TANNI Premium 02 Plus, Ghế Xoay Văn Phòng Gaming Cao Cấp Nhập Khẩu",TANNI,1.329.000₫,Đã bán 106,4.6,4.0,20,7,0,0,1,
https://tiki.vn/ke-sach-thong-minh-ke-sach-de-san-cao-cap-11-tang-go-mdf-phu-melamin-chong-nuoc-chong-xuoc-hang-chinh-hang-p37495650.html?spid=37495651,"Kệ Sách Để Sàn Cao Cấp 11 Tầng Bằng Gỗ MDF Phủ Melamin Chống Nước, Chống Xước - Hàng Chính Hãng",IGA,411.240₫,Đã bán 3174,4.5,1.0,518,182,34,13,35,
https://tiki.vn/guong-dan-tuong-30x30cm-trang-tri-phu-hop-moi-khong-gian-p252389920.html?spid=134407757,Gương Dán Tường 30x30cm Trang Trí Phù Hợp Mọi Không Gian,OEM,29.000₫,Đã bán 321,3.6,4.0,8,3,1,1,4,
https://tiki.vn/ke-go-de-man-hinh-may-tinh-laptop-ban-lam-viec-hang-chinh-hang-tido-p255407025.html?spid=255407031,"Kệ gỗ để màn hình máy tính, laptop bàn làm việc - Hàng chính hãng TIDO",TIDO noithatTIDO.vn,74.000₫,Đã bán 30,5.0,2.0,4,0,0,0,0,
https://tiki.vn/tu-quan-ao-vai-tu-vai-khung-thep-titan-cao-cap-chot-kim-loai-tuoi-tho-8-10-nam-bao-hanh-12-thang-p262513780.html?spid=271685700,"Tủ Quần Áo Vải, Tủ Vải Khung Thép Titan Cao Cấp Chốt Kim Loại Tuổi Thọ 8-10 Năm Bảo Hành 12 Tháng",OEM,470.000₫,Đã bán 55,4.7,,11,4,0,0,0,
https://tiki.vn/ke-go-trang-tri-treo-tuong-co-moc-inox-khong-can-khoan-thuong-hieu-kegoda-nhieu-kich-thuoc-p192975755.html?spid=273198647,Kệ Gỗ Trang Trí Treo Tường Không Cần Khoan - Tặng Kèm Móc Treo Inox Và Phụ Kiện,kegoda,79.000₫,Đã bán 183,4.8,,26,1,0,0,1,
https://tiki.vn/tu-quan-ao-doi-119x150-cm-p25153119.html?spid=91337468,TỦ QUẦN ÁO ĐÔI 119x150 cm,OEM,660.000₫,Đã bán 266,4.6,,69,13,6,1,2,
https://tiki.vn/giuong-ngu-gap-gon-nghi-trua-van-phong-thu-gian-ph22115-giuong-xep-don-thong-minh-hien-dai-hang-chinh-hang-p242075552.html?spid=242075554,Giường Ngủ Gấp Gọn Nghỉ Trưa Văn Phòng Thư Giãn PH22115 Giường Xếp Đơn Thông Minh Hiện Đại - Hàng Chính Hãng,pehouse,950.000₫,Đã bán 263,4.8,2.0,38,4,1,0,1,
https://tiki.vn/ke-tab-dau-giuong-ke-decor-go-thong-2-tang-50cm-p115972805.html?spid=115972806,Kệ Tab Đầu Giường- Kệ Decor Gỗ Thông 2 Tầng 50cm,Morninghouse,129.000₫,Đã bán 321,4.7,,58,16,4,1,0,
