Link,Name,Brand,Price,Sale,Stars,NumberOfCoupon,5 stars,4 stars,3 stars,2 stars,1 star,Reviews
https://tiki.vn/hop-nhua-thung-nhua-dung-do-da-nang-co-banh-xe-di-chuyen-co-khop-de-xep-chong-len-nhau-thanh-tu-hang-chinh-hang-nikita-p207818569.html?spid=207818581,"Hộp nhựa, Thùng nhựa đựng đồ đa năng - Có bánh xe di chuyển - Có khớp để xếp chồng lên nhau thành tủ - Hàng chính hãng NIKITA",Nikita,219.000₫,Đã bán 20,5.0,5.0,4,0,0,0,0,
https://tiki.vn/ban-lam-viec-ban-hoc-ban-may-tinh-ke-lung-p131407909.html?spid=201601051,Bàn làm việc bàn học bàn máy tính kệ lửng,OEM,193.995₫,Đã bán 38,4.5,,4,1,1,0,0,
https://tiki.vn/ke-sach-de-ban-bang-go-lap-ghep-tien-loi-lap-ghep-de-dang-su-dung-tien-loi-p120339251.html?spid=120339255,"Kệ Sách Để Bàn Bằng Gỗ Lắp Ghép Tiện Lợi, lắp ghép dễ dàng, sử dụng tiện lợi",OEM,124.000₫,Đã bán 45,4.5,6.0,7,3,0,1,0,
https://tiki.vn/ban-lam-viec-thong-minh-nang-ha-chieu-cao-co-banh-xe-di-chuyen-mat-nghieng-gap-gon-size-to-80x50cm-p193773962.html?spid=193773966,"Bàn Làm Việc Thông Minh Nâng Hạ Chiều Cao Có Bánh Xe Di Chuyển, Mặt Nghiêng Gấp Gọn Size To 80x50cm",pehouse,765.000₫,Đã bán 29,4.7,1.0,6,0,1,0,0,
https://tiki.vn/ban-trang-diem-ngoi-bet-thong-minh-guong-gap-tien-ich-p53970712.html?spid=53970713,Bàn Trang Điểm Ngồi Bệt Thông Minh Gương Gập Tiện Ích,IGA,310.960₫,Đã bán 840,4.5,1.0,232,57,21,12,18,
https://tiki.vn/ngan-keo-dan-duoi-ban-dung-vat-dung-mohi-nkb02-kich-thuoc-22x9-3x3-5cm-chinh-hang-ngau-nhien-p89649401.html?spid=89649405,"Ngăn Kéo Dán Dưới Bàn Đựng Vật Dụng, Đồ Dùng Văn Phòng Nhỏ Gọn - Hàng Chính Hãng - Giao Màu Ngẫu Nhiên",MO hi,51.700₫,Đã bán 107,5.0,,11,1,0,0,0,
https://tiki.vn/ke-sach-mini-bang-go-de-tren-ban-lam-viec-hoac-ban-hoc-hang-tu-lap-ghep-da-nang-thong-minh-gom-3-mau-dep-hien-dai-p56247996.html?spid=70882520,"Kệ sách mini bằng gỗ, để trên bàn làm việc hoặc bàn học. Hàng tự lắp ghép đa năng, thông minh. Gồm 3 màu đẹp hiện đại.",OEM,84.000₫,Đã bán 387,4.3,5.0,72,14,8,5,8,
https://tiki.vn/ke-de-man-hinh-may-tinh-ban-phim-sach-va-do-van-phong-sib-decor-ke-khong-bao-gom-cac-san-pham-khac-p59288213.html?spid=59288214,"Kệ Để Màn Hình Máy Tính, Bàn Phím, Sách và Đồ Văn Phòng SIB DECOR (Kệ Không Bao Gồm Các Sản Phẩm Khác)",SIB DECOR,255.000₫,Đã bán 589,5.0,2.0,157,23,2,0,0,
https://tiki.vn/ke-treo-tuong-go-trang-tri-mdf-fivo-fb40-khong-can-khoan-voi-moc-treo-inox-de-dang-gan-tuong-hang-chinh-hang-p195575396.html?spid=195575408,Kệ Treo Tường Gỗ Trang Trí MDF FIVO FB40 Không Cần Khoan Với Móc Treo Inox Dễ Dàng Gắn Tường - Hàng Chính Hãng,FIVO,74.000₫,Đã bán 52,4.2,4.0,6,6,0,0,1,
https://tiki.vn/da-dan-ghe-sofa-sua-chua-ghe-cat-toc-da-dan-pu-tu-dinh-tiet-kiem-chi-phi-tai-nha-p272920759.html?spid=272920791,"Da Dán Ghế Sofa , Sửa Chữa Ghế Cắt Tóc , Da Dán Pu Tự Dính Tiết Kiệm Chi Phí Tại Nhà",OEM,195.000₫,Đã bán 7,5.0,1.0,1,0,0,0,0,
https://tiki.vn/ong-hit-thong-mui-den-2-dau-black-inhaler-peppermint-thai-lan-p197541186.html?spid=197541187,Ống Hít Thông Mũi Đen 2 Đầu Black Inhaler Peppermint Thái Lan,OEM,45.000₫,Đã bán 71,5.0,,9,1,0,0,0,
https://tiki.vn/ban-hoc-nhua-viet-nhat-cho-be-co-ong-cam-but-va-dung-sach-vo-p149212278.html?spid=262884783,Bàn học nhựa Việt Nhật cho bé có ống cắm bút và đựng sách vở,OEM,73.000₫,Đã bán 28,4.0,,0,1,0,0,0,
https://tiki.vn/khay-dung-tai-lieu-ke-dung-tai-lieu-3-ngan-de-ban-ke-xeo-nhua-dung-ho-so-tien-loi-sieu-re-p104466147.html?spid=177518720,kệ đựng tài liệu 3 ngăn để bàn kệ xéo nhựa đựng hồ sơ tiện lợi siêu rẻ,OEM,38.000₫,Đã bán 93,5.0,,7,0,0,0,0,
