Link,Name,Brand,Price,Sale,Stars,NumberOfCoupon,5 stars,4 stars,3 stars,2 stars,1 star,Reviews
https://tiki.vn/bo-quan-ao-di-mua-3xl-p16382292.html?spid=51344019,Bộ Quần Áo Đi Mưa - 3XL,OEM,143.900₫,Đã bán 58,5.0,,7,1,0,0,0,
https://tiki.vn/bau-nhua-uom-cay-thong-minh-ropot-60cm-x-5m-p72745465.html?spid=189594365,Bầu Nhựa Ươm Cây Thông Minh RoPot 60cm x 5m,OEM,105.000₫,Đã bán 20,5.0,,1,0,0,0,0,
https://tiki.vn/1kg-chau-uom-cay-giong-nilon-den-du-moi-kich-thuoc-bau-uom-cay-giong-cac-loai-cay-trong-p191756649.html?spid=191756657,1Kg Chậu Ươm Cây Giống Nilon Đen - Đủ Mọi Kích Thước - Bầu Ươm Cây Giống Các Loại Cây Trồng,OEM,64.000₫,Đã bán 10,,1.0,,,,,,
https://tiki.vn/cay-linh-sam-bonsai-cay-canh-bonsai-tang-phan-bon-cho-cay-p152446763.html?spid=152446769,Cây Linh Sam Bonsai - cây cảnh bonsai + tặng phân bón cho cây,OEM,65.000₫,Đã bán 149,4.5,,18,5,2,0,2,
https://tiki.vn/hat-giong-bau-ho-lo-f1-nay-mam-cao-p64279478.html?spid=64279479,Hạt giống Bầu hồ lô F1 - nảy mầm cao,Titapha,13.900₫,Đã bán 332,4.1,,41,14,1,5,8,
https://tiki.vn/bo-voi-tuoi-cay-rua-xe-12m-kem-voi-tuoi-6-che-do-hang-nhap-khau-p184913941.html?spid=184913942,"Bộ Vòi Tưới Cây , Rửa Xe 12m Kèm Vòi Tưới 6 Chế Độ - Hàng Nhập Khẩu",PEAFLO,451.000₫,Đã bán 128,4.3,5.0,8,2,1,0,1,
https://tiki.vn/combo-3-chai-phan-bo-n-la-pha-sa-n-cho-hoa-lan-va-cay-canh-dang-xit-dau-trau-spray-1-500ml-chai-p7238765.html?spid=7238767,Combo 3 chai phân bón lá pha sẵn cho Hoa lan và cây cảnh dạng xịt Đầu Trâu Spray 1 (500ml/chai),Bình Điền Mekong,119.000₫,Đã bán 187,4.8,,29,3,2,0,0,
https://tiki.vn/thuoc-tru-sau-dang-rai-sieugon-85gr-tru-sau-duc-than-lua-bo-ha-sung-dat-goi-1kg-p197173588.html?spid=197173589,"Thuốc trừ sâu dạng rãi SIEUGON 85GR trừ sâu đục thân lúa, bọ hà, sùng đất - gói 1kg",OEM,55.700₫,Đã bán 128,3.0,,0,0,1,0,0,
https://tiki.vn/ung-boc-giay-di-mua-chong-tron-truot-p16178393.html?spid=188728977,Ủng bọc giầy đi mưa chống trơn trượt,OEM,104.900₫,Đã bán 52,5.0,,6,0,0,0,0,
https://tiki.vn/combo-12-thanh-vi-go-lot-san-ngoai-troi-mau-go-tu-nhien-p10070225.html?spid=182840705,Combo 12 thanh Vỉ Gỗ Lót Sàn Ngoài Trời - Màu Gỗ Tự Nhiên,OEM,179.000₫,Đã bán 18,4.0,1.0,2,0,0,1,0,
https://tiki.vn/ung-boc-giay-di-mua-di-phuot-chong-nuoc-co-de-chong-truot-p22430108.html?spid=188729329,Ủng bọc giày đi mưa đi phượt chống nước có đế chống trượt,OEM,44.000₫,Đã bán 35,3.5,,1,0,0,1,0,
https://tiki.vn/hat-giong-rau-ngai-cuu-ct352-goi-50-hat-p167359227.html?spid=167359231,Hạt Giống Rau Ngải Cứu CT352 - Gói 50 hạt,OEM,18.000₫,Đã bán 33,4.5,,1,1,0,0,0,
https://tiki.vn/du-gap-nguoc-chuyen-dung-cho-o-to-p9854813.html?spid=169410655,Dù gấp ngược chuyên dụng cho ô tô,OEM,91.198₫,Đã bán 37,,3.0,,,,,,
https://tiki.vn/cay-hoa-giay-cam-thach-mau-do-cay-canh-de-ban-tang-phan-bon-cho-cay-p173820035.html?spid=173820036,Cây hoa giấy cẩm thạch (màu đỏ) - cây cảnh để bàn + tặng phân bón cho cây,OEM,45.000₫,Đã bán 36,4.5,,5,2,0,1,0,
https://tiki.vn/chau-nhua-lap-rap-d40xr40xc22cm-trong-hoa-hong-cay-leo-rau-cu-qua-do-ben-5-nam-nhieu-kich-thuoc-greenhome-p198510237.html?spid=210155314,"Chậu nhựa lắp ráp, trồng hoa hồng, cây leo, rau, củ, quả, độ bền 5 năm, nhiều kích thước lựa chọn |Greenhome",Greenhome,169.000₫,Đã bán 151,4.7,4.0,13,0,0,0,1,
https://tiki.vn/dat-trong-cay-lavamix-bao-20dm3-9-10kg-dat-huu-co-trong-rau-hoa-kieng-tien-loi-de-su-dung-greenhome-p191140214.html?spid=191806321,"Đất trồng cây Lavamix, bao 20dm3 (9-10kg), đất hữu cơ trồng rau, hoa, kiểng, tiện lợi, dễ sử dụng",Lavamix,44.900₫,Đã bán 67,5.0,4.0,5,0,0,0,0,
https://tiki.vn/voi-phun-xit-nuoc-rua-xe-tuoi-cay-chuyen-nghiep-tang-ap-luc-nuoc-300-voi-tang-ap-luc-nuoc-voi-rua-xe-voi-tuoi-cay-cham-soc-oto-rua-xe-oto-206701-p52178643.html?spid=56219945,"Vòi Phun Xịt Nước Rửa Xe Tưới Cây Chuyên Nghiệp Tăng Áp Lực Nước 300% - vòi tăng áp lục nước, vòi rửa xe, vòi tưới cây - Chăm Sóc Oto - Rửa Xe Oto - 206701",OEM,71.000₫,Đã bán 207,4.5,,32,19,6,1,1,
https://tiki.vn/02-goi-hat-giong-hoa-cuc-da-lat-nhieu-mau-ha-lan-vts04-p55676199.html?spid=55676200,Hạt giống hoa cúc Đà Lạt nhiều màu VTS04,Sen Vàng Seeds,14.000₫,Đã bán 80,4.1,,3,2,2,0,0,
https://tiki.vn/bo-quan-ao-mua-vai-du-ran-ri-tu-50-95kg-2-lop-khoa-chong-nuoc-chong-rach-p80944901.html?spid=253229645,Bộ Quần Áo Mưa Vải Dù Rằn Ri Từ 50-95kg 2 Lớp Khóa Chống Nước Chống Rách,OEM,120.000₫,Đã bán 64,4.5,,10,3,0,0,1,
https://tiki.vn/hat-giong-hoa-thuoc-duoc-mix-nay-mam-cuc-chuan-p37265175.html?spid=96987014,Hạt Giống Hoa Thược Dược Mix - Nảy Mầm Cực Chuẩn,OEM,7.000₫,Đã bán 166,4.3,,12,5,0,0,2,
https://tiki.vn/che-pham-sinh-hoc-diet-bo-tri-rep-sap-nhen-do-ray-sau-cho-hoa-hong-cay-canh-da-pha-san-xit-truc-tiep-an-toan-p158610820.html?spid=158610821,"Chế Phẩm Sinh Học Diệt Bọ Trĩ, Rệp Sáp, Nhện Đỏ, Rầy, Sâu Cho Hoa Hồng, Cây Cảnh - Đã Pha Sẵn, Xịt Trực Tiếp, An Toàn",Thủy Kim Sinh,51.000₫,Đã bán 603,4.5,,63,15,2,2,8,
https://tiki.vn/van-phao-co-nuoc-mini-tu-ngat-khi-day-dieu-chinh-muc-nuoc-chat-lieu-inox-304-p259567940.html?spid=259567942,"Van Phao Cơ Nước Mini Tự Ngắt Khi Đầy, Điều Chỉnh Mực Nước, Chất Liệu Inox 304",DORON the best service,120.000₫,Đã bán 45,4.5,,8,1,0,0,1,
https://tiki.vn/cay-hoa-hong-nhung-cay-canh-de-ban-tang-phan-bon-cho-cay-p152446569.html?spid=152446576,Cây Hoa Hồng Nhung - cây cảnh để bàn + tặng phân bón cho cây,OEM,35.000₫,Đã bán 47,4.3,,12,4,0,0,2,
https://tiki.vn/500gr-day-nhom-uon-cay-canh-cao-cap-du-moi-kich-thuoc-p86962523.html?spid=86962545,500gr DÂY NHÔM UỐN CÂY CẢNH CAO CẤP - ĐỦ MỌI KÍCH THƯỚC,OEM,65.000₫,Đã bán 459,4.8,1.0,47,12,1,0,0,
https://tiki.vn/10-que-cam-cay-hoa-lan-loi-kim-loai-boc-nhua-xanh-cao-70cm-p86962049.html?spid=86962053,10 Que cắm Cây - Hoa lan lõi kim loại bọc nhựa xanh cao 70cm,OEM,32.000₫,Đã bán 37,5.0,,2,0,0,0,0,
https://tiki.vn/de-lot-chau-cay-bang-sat-r21xc10cm-son-tinh-dien-mau-den-uon-my-nghe-ben-dep-greenhome-p190702462.html?spid=190702464,"Đế lót chậu cây bằng sắt, R21xC10cm, sơn tĩnh điện, màu đen, uốn mỹ nghệ, bền, đẹp |Greenhome",Greenhome,34.900₫,Đã bán 167,5.0,4.0,3,0,0,0,0,
https://tiki.vn/gia-the-mun-dua-da-qua-xu-ly-sfarm-p85186733.html?spid=85186734,Giá thể mụn dừa đã qua xử lý Sfarm,sfarm,18.000₫,Đã bán 1154,4.8,,72,13,1,0,1,
https://tiki.vn/dong-ho-do-nhiet-do-do-am-htc-2-p20302728.html?spid=68881809,Đồng hồ đo nhiệt độ độ ẩm HTC-2,OEM,135.000₫,Đã bán 16,3.0,,1,2,0,0,2,
https://tiki.vn/bo-day-cap-nuoc-1-5m-p56958193.html?spid=56958194,Bộ dây cấp nước 1.5m,Karcher,214.000₫,Đã bán 108,5.0,4.0,23,2,0,0,0,
https://tiki.vn/diet-sach-bo-tri-ray-rep-sap-khong-lo-nong-dot-bong-trai-non-p222627474.html?spid=222627475,"[ DIỆT SẠCH BỌ TRĨ ] Rầy, Rệp Sáp không lo Nóng Đọt, Bông, Trái Non",OEM,25.000₫,Đã bán 59,4.0,,0,1,0,0,0,
https://tiki.vn/o-du-gap-gon-du-che-mua-chong-tia-uv-10-nan-nhieu-mau-p214960936.html?spid=271539123,"Ô Dù gấp gọn , dù che mưa , chống tia UV 10 nan ( nhiều mẫu )",OEM,125.000₫,Đã bán 6,,1.0,,,,,,
https://tiki.vn/hat-giong-cay-xa-den-cay-duoc-lieu-50-hat-goi-p142794405.html?spid=142794408,Hạt Giống Cây Xạ Đen - (Cây dược liêu ) 50 hạt/gói,OEM,15.000₫,Đã bán 10,1.0,,0,0,0,0,1,
https://tiki.vn/cay-giong-chanh-day-ngot-trai-vang_-chanh-leo-ghep-goc-cay-lac-tien-sau-cong-soc-trang-trong-chau-nhanh-cho-trai-p221779951.html?spid=221779961,Cây Giống Chanh Dây Ngọt trái vàng_ Chanh Leo ghép gốc cây lạc tiên (Sáu Công Sóc Trăng) trồng chậu nhanh cho trái,OEM,150.000₫,Đã bán 3,2.0,,0,0,0,1,0,
https://tiki.vn/cu-khoai-mai-tuoi-p271993277.html?spid=271993279,Củ khoai mài tươi,OEM,110.000₫,Đã bán 2,,,,,,,,
https://tiki.vn/luoi-trong-cay-luoi-lam-gian-leo-kich-thuoc-mat-luoi-12-x-12cm-soi-cao-2-0mm-p147880111.html?spid=147880138,"Lưới Trồng Cây,Lưới Làm Giàn Leo Kích Thước Mắt Lưới 12 x 12cm Sợi Cào 2.0mm",OEM,47.000₫,Đã bán 78,4.0,1.0,0,1,0,0,0,
https://tiki.vn/voi-nuoc-2-dau-ra-da-nang-xrui-hk-voi-kep-2-van-khoa-gan-tuong-danh-cho-may-giat-p116409190.html?spid=173435695,"Vòi nước 2 đầu ra đa năng XRUI-HK, Vòi kép 2 van khóa gắn tường dành cho máy giặt",OEM,84.000₫,Đã bán 30,4.7,1.0,2,1,0,0,0,
https://tiki.vn/hat-giong-rau-mam-cu-cai-50gr-trang-do-p15341767.html?spid=53394853,Hạt giống rau mầm củ cải 50gr - Trắng /đỏ,OEM,9.000₫,Đã bán 1439,4.5,1.0,116,17,6,1,13,
https://tiki.vn/30h-hat-giong-hoa-huong-duong-sieu-bong-nhuy-vang-p98606356.html?spid=171806159,30H - HẠT GIỐNG HOA HƯỚNG DƯƠNG SIÊU BÔNG NHUỴ VÀNG,OEM,15.000₫,Đã bán 5,4.0,,0,1,0,0,0,
https://tiki.vn/hat-giong-bi-ngoi-xanh-f1-nay-mam-cao-p58377644.html?spid=58377645,Hạt giống Bí Ngòi Xanh F1 - nảy mầm cao,Titapha,13.900₫,Đã bán 292,4.5,,27,2,1,1,3,
https://tiki.vn/dia-nhua-lot-day-chau-khay-lot-chau-de-lot-chau-chong-chay-nuoc-dia-lot-da-nang-nhieu-size-p143606011.html?spid=143606533,"Đĩa Nhựa Lót Đáy Chậu, Khay Lót Chậu, Đế Lót Chậu Chống Chảy Nước, Đĩa Lót Đa Năng (nhiều size)",OEM,4.900₫,Đã bán 156,5.0,,7,1,0,0,0,
https://tiki.vn/hat-no-lam-slime-tinh-the-trong-cay-goi-500g-khoang-40000v-duoc-lua-mau-p169932791.html?spid=169932800,"Hạt nở làm slime ,tinh thể trồng cây gói 500g khoảng 40000v (được lựa màu)",OEM,145.000₫,Đã bán 3,4.0,,0,2,0,0,0,
https://tiki.vn/1kg-xut-vay-naoh-99-xu-li-nuoc-ho-boi-ung-dung-trong-nganh-det-nhuom-y-duoc-hoa-huu-co-tong-hop-p187162297.html?spid=187162298,"1kg xút vảy NaOH 99% xử lí nước hồ bơi, ứng dụng trong ngành dệt nhuộm, y dược, hóa hữu cơ tổng hợp",OEM,70.000₫,Đã bán 6,,,,,,,,
https://tiki.vn/hat-giong-co-la-gung-co-la-tre-de-trong-f1-goi-50-gram-p272237746.html?spid=272237747,"Hạt giống cỏ lá gừng,cỏ lá tre dể trồng f1-gói 50 gram-tặng kemg gói phân bón",OEM,60.000₫,Đã bán 8,,,,,,,,
https://tiki.vn/te-21-27-34-42-49-60-rm-p138616670.html?spid=138616713,"Tê 21, 27, 34, 42, 49 , 60 RM",OEM,9.000₫,Đã bán 91,4.5,,2,2,0,0,0,
https://tiki.vn/manh-che-nang-1-5x2m-co-phu-kien-keo-che-nang-che-mua-gia-re-nhat-hang-co-may-dau-p176070806.html?spid=176070807,"Mành che nắng 1,5x2m có phụ kiện kéo, che nắng che mưa, giá rẻ nhất, hàng có may đầu",OEM,145.000₫,Đã bán 21,4.7,,2,1,0,0,0,
https://tiki.vn/oc-phi-tec-nhua-oc-ren-bon-nuoc-p132183665.html?spid=132183674,Ốc phi téc nhựa - Ốc ren bồn nước,OEM,14.000₫,Đã bán 8,5.0,,3,0,0,0,0,
https://tiki.vn/5kg-tcca-90-vien-nen-200g-chinh-hang-clorine-vien-dang-sui-xu-ly-nuoc-ho-boi-khu-trung-sat-khuan-phong-dich-tot-p160672075.html?spid=160672076,"5KG TCCA 90% VIÊN NÉN 200G - Clorine viên dạng sủi xử lý nước hồ bơi, Khử trùng sát khuẩn, phòng dịch tốt",OEM,580.000₫,Đã bán 57,5.0,,7,0,0,0,0,
https://tiki.vn/dai-phun-nuoc-hinh-tron-su-dung-nang-luong-mat-troi-206800-p161866464.html?spid=161866614,Đài Phun Nước Hình Tròn Sử Dụng Năng Lượng Mặt Trời 206800,OEM,223.300₫,Đã bán 7,5.0,4.0,1,0,0,0,0,
https://tiki.vn/but-thu-nuoc-hold-3-bao-da-dung-cu-do-tds-may-do-do-cung-cua-nuoc-p13059610.html?spid=58441608,"Bút thử nước Hold -3 (Bao da), dụng cụ đo TDS, máy đo độ cứng của nước",OEM,40.500₫,Đã bán 8,2.0,,0,1,0,0,2,
https://tiki.vn/combo-10-cai-kep-moc-cang-luoi-bat-che-nang-mau-den-p272467506.html?spid=272467507,Combo 10 cái Kẹp Móc Căng Lưới Bạt Che Nắng Màu Đen,OEM,15.000₫,Đã bán 2,,,,,,,,
https://tiki.vn/hat-giong-rau-muong-thai-lan-f1-nay-mam-cao-p58312952.html?spid=58312953,Hạt giống Rau Muống Thái Lan F1 nảy mầm cao,Titapha,11.900₫,Đã bán 1945,4.6,,152,28,2,5,7,
https://tiki.vn/hat-giong-hoa-van-tho-phap-ban-mai-vts112-p71002843.html?spid=71002844,Hạt giống hoa Vạn Thọ Pháp Ban Mai VTS112,Sen Vàng Seeds,17.000₫,Đã bán 49,4.5,,3,0,1,0,0,
https://tiki.vn/hat-giong-hanh-la-f1-nay-mam-cao-titapha-p114880669.html?spid=114880673,Hạt giống Hành Lá F1 - Nảy mầm cao Titapha,Titapha,19.000₫,Đã bán 252,4.6,1.0,20,3,0,0,2,
https://tiki.vn/phan-bo-da-qua-xu-ly-3-dm3-lavamix-trong-rau-sach-bang-dat-sach-xo-dua-va-phan-bon-huu-co-p117002314.html?spid=117002326,"Phân Bò Đã Qua Xử Lý 3 dm3 - Lavamix Trồng Rau Sạch Bằng Đất Sạch, Xơ Dừa Và Phân Bón Hữu Cơ",Lavamix,12.000₫,Đã bán 2299,4.8,,110,19,6,0,0,
https://tiki.vn/02-goi-hat-giong-hoa-cuc-violet-hoa-cuc-tim-vtp90-p71002388.html?spid=71002389,Hạt giống hoa Cúc Violet - hoa Cúc Tím VTP90,OEM,13.000₫,Đã bán 232,4.5,,30,8,2,1,3,
https://tiki.vn/thuoc-tru-sau-huu-co-sinh-hoc-comda-250ec-650ml-p106062055.html?spid=106062056,THUỐC TRỪ SÂU HỮU CƠ SINH HỌC COMDA 250EC 650ML,OEM,49.900₫,Đã bán 328,4.5,,35,8,1,0,3,
https://tiki.vn/hat-giong-hoa-mong-ga-duoi-phung-nhieu-mau-hoa-mao-ga-phung-vy-mix-vts108-p68237320.html?spid=68237321,Hạt giống hoa Mồng Gà Đuôi Phụng nhiều màu - hoa Mào Gà Phụng Vỹ Mix VTS108,Sen Vàng Seeds,18.000₫,Đã bán 101,4.6,,10,8,0,0,0,
https://tiki.vn/hat-giong-bi-dao-chanh-lai-f1-sieu-trai-sinh-truong-khoe-trong-quanh-nam-goi-0-2-gram-hat-giong-rang-dong-p153390587.html?spid=171186884,"Hạt giống Bí Đao Chanh Lai F1 Siêu Trái, Sinh Trưởng Khỏe, Trồng Quanh Năm - Hạt giống Rạng Đông",Rạng Đông,11.000₫,Đã bán 16,,,,,,,,
https://tiki.vn/cay-chuong-vang-cay-hoang-yen-tang-phan-bon-cho-cay-mau-lon-p193738624.html?spid=193738625,Cây Chuông Vàng - cây hoàng yến,OEM,6.000₫,Đã bán 70,4.2,,5,3,0,0,1,
https://tiki.vn/da-cau-vong-kich-re-dam-mau-thoat-nuoc-tot-chuyen-xuong-rong-sen-bonsai-greenhome-p217167230.html?spid=217167234,"Đá cầu vồng, kích rễ, đậm màu, thoát nước tốt, chuyên xương rồng, sen, bonsai Greenhome",Greenhome,400.000₫,Đã bán 45,4.7,4.0,2,1,0,0,0,
https://tiki.vn/ao-mua-thiet-ke-thoi-trang-agnite-chat-lieu-pe-sieu-dai-mau-sac-da-dang-vs4073-p272278818.html?spid=272278824,Áo mưa thiết kế thời trang Agnite - Chất liệu PE siêu dai - Màu sắc đa dạng - VS4073,Agnite,5.000₫,Đã bán 66,,5.0,,,,,,
https://tiki.vn/sieu-ra-re-npk-33-11-11-giup-to-la-bung-dot-to-trai-p263559488.html?spid=263559489,"Siêu Ra Rễ NPK 33.11.11 giúp to lá, bung đọt, to trái.",OEM,10.000₫,Đã bán 38,,,,,,,,
https://tiki.vn/vien-nen-xo-dua-bao-50-vien-uom-hat-giong-trong-cay-uom-hat-uom-cay-giong-trong-dau-tay-thuy-canh-greenhome-p190899644.html?spid=191004858,"Viên nén xơ dừa, ươm hạt giống trồng cây, ươm hạt, ươm cây giống, trồng dâu tây, thuỷ canh |Greenhome",Greenhome,44.900₫,Đã bán 37,4.7,4.0,2,1,0,0,0,
https://tiki.vn/hat-giong-du-du-lun-f1-nay-mam-cao-p59423171.html?spid=59423172,Hạt giống Đu Đủ lùn F1 - Nảy mầm cao,Titapha,13.900₫,Đã bán 1035,4.1,,87,25,6,4,20,
https://tiki.vn/03-goi-hat-giong-xa-lach-xoong-my-vts41-p55612179.html?spid=55612180,Hạt giống xà lách xoong Mỹ VTS41,Sen Vàng Seeds,14.000₫,Đã bán 79,4.0,,1,1,1,0,0,
https://tiki.vn/03-goi-hat-giong-xa-lach-minetto-vts101-p67245824.html?spid=67245825,Hạt giống xà lách Minetto VTS101,Sen Vàng Seeds,12.000₫,Đã bán 167,4.7,,12,2,1,0,0,
https://tiki.vn/cay-su-thai-kep-hoa-vang-cay-canh-trong-nha-tang-phan-bon-cho-cay-mau-lon-p193738508.html?spid=193738509,Cây Sứ Thái Kép Hoa Vàng - cây cảnh trong nhà + tặng phân bón cho cây,OEM,45.000₫,Đã bán 62,4.5,,8,3,0,0,1,
https://tiki.vn/mang-treo-ong-nuoc-eco-0-claber-8866-p6188599.html?spid=6188601,Máng treo ống nước Eco 0 Claber 8866,Claber,150.000₫,Đã bán 403,4.7,,42,8,2,0,1,
https://tiki.vn/chau-trong-cay-thong-minh-treo-tuong-oliz-k0-thiet-ke-2-lop-co-kha-nang-tu-tuoi-nuoc-cho-cay-p242630641.html?spid=242630669,"Chậu trồng cây thông minh treo tường Oliz K0. Thiết kế 2 lớp, có khả năng tự tưới nước cho cây",OEM,29.000₫,Đã bán 71,5.0,,18,1,0,0,0,
https://tiki.vn/nam-doi-khang-trichoderma-bacillus-nano-xgreen-aht_corp-1kg-chuyen-dung-trong-nong-nghiep-cung-cap-enzyme-ho-tro-qua-trinh-phan-huy-mun-chat-huu-co-phan-bo-phan-ga-p93024943.html?spid=93024944,"Nấm đối kháng Trichoderma Bacillus Nano Xgreen AHT_Corp 1kg- Chuyên Dùng Trong Nông Nghiệp Cung Cấp Enzyme Hỗ Trợ Quá Trình Phân Hủy Mùn, Chất Hữu Cơ, phân bò, phân gà",AHT CORP,59.000₫,Đã bán 44,5.0,1.0,4,0,0,0,0,
https://tiki.vn/keo-cat-canh-cong-luc-chuyen-dung-germany-dung-cu-lam-vuon-da-nang-p250512089.html?spid=190322460,Kéo cắt cành cộng lực chuyên dụng Germany -dụng cụ làm vườn đa năng,OEM,152.000₫,Đã bán 411,4.6,,62,17,2,3,1,
https://tiki.vn/02-goi-hat-giong-hoa-cuc-dai-doa-canh-to-nhieu-mau-ha-lan-vts57-p56650597.html?spid=56650598,Hạt giống hoa Cúc đại đóa cánh to nhiều màu VTS57,Sen Vàng Seeds,17.000₫,Đã bán 79,4.5,,5,3,1,0,0,
https://tiki.vn/hat-giong-ca-chua-bi-cherry-f1-nay-mam-cao-titapha-p66628603.html?spid=66628604,Hạt giống Cà chua bi Cherry F1 nảy mầm cao Titapha,Titapha,13.900₫,Đã bán 1101,4.5,,94,32,5,2,9,
https://tiki.vn/o-du-tu-dong-2-chieu-cao-cap-besti-che-mua-che-nang-chong-uv-hang-chinh-hang-p183254388.html?spid=183254396,"Ô (Dù) Tự Động 2 Chiều Cao Cấp Teement, Che Mưa, Che Nắng, Chống UV - Hàng Chính Hãng",TEEMENT,170.000₫,Đã bán 100,4.5,,16,4,1,0,2,
https://tiki.vn/hcm-ao-mua-cao-cap-bit-kin-vai-da-ca-ao-mua-da-ca-co-day-keo-khoa-bo-di-mua-trum-1-dau-mot-nguoi-cao-cap-gia-re-thoi-trang-di-xe-may-p206267381.html?spid=270692794,"[HCM] Áo Mưa Cao Cấp Bít Kín Vải Da Cá - Áo Mưa Da Cá Có Dây Kéo Khóa ( Bộ Đi Mưa Trùm 1 Đầu Một Người, Cao Cấp, Giá Rẻ, Thời Trang, Đi Xe Máy )",OEM,95.000₫,Đã bán 99,4.8,3.0,18,5,0,0,0,
https://tiki.vn/ao-mua-tre-em-canh-roi-xuat-nhat-hinh-thu-vui-nhon-cho-be-tu-2-7-tuoi-free-size-110-120cm-p89233680.html?spid=89233727,Áo mưa trẻ em cánh rơi xuất nhật hình thú vui nhộn cho bé từ 2-7 tuổi ( free size 110-120cm ),OEM,65.000₫,Đã bán 275,4.6,,39,9,0,3,1,
https://tiki.vn/ao-mua-bo-cao-cap-p13811350.html?spid=41094760,Áo mưa bộ cao cấp,OEM,699.000₫,Đã bán 58,4.7,1.0,5,2,0,0,0,
https://tiki.vn/hat-giong-xa-lach-minetto-tim-vtp138-p155529441.html?spid=155529442,Hạt giống Xà lách Minetto Tím VTP138,An Phát,13.500₫,Đã bán 24,5.0,,1,0,0,0,0,
https://tiki.vn/vi-go-lot-san-thuong-hieu-ankan-mau-nau-vang-van-go-lot-san-ban-cong-san-vuon-ho-boi-phong-spa-sieu-ben-chiu-nuoc-tot-chong-tron-truot-tieu-chuan-xuat-khau-8-vi-p52354974.html?spid=52354976,"Combo 9 Ván Sàn Gỗ Tự Nhiên Màu Nâu Vàng, Vỉ Gỗ Lót Sàn Ban Công, Sân Vườn, Hồ Bơi, Phòng Spa, Siêu Bền, Chịu Nước Tốt, Chống Trơn Trượt, Tiêu Chuẩn Xuất Khẩu",ANKAN,249.000₫,Đã bán 503,4.7,3.0,42,8,3,1,0,
https://tiki.vn/set-100-tui-boc-trai-cay-16x18cm-bang-vai-khong-det-chuyen-dung-boc-oi-cam-na-bo-mang-cau-vu-sua-p169930886.html?spid=169930890,"set 100 Túi bọc trái cây 16x18cm bằng vải không dệt chuyên dùng bọc Ổi, Cam, Na, Bơ, Mãng cầu, Vú Sữa",OEM,62.500₫,Đã bán 47,4.7,,2,1,0,0,0,
https://tiki.vn/o-du-gap-nguoc-2-lop-chong-tia-uv-hang-cao-cap-p29808513.html?spid=94276902,Ô dù gấp ngược 2 lớp chống tia UV - Hàng Cao Cấp,OEM,78.800₫,Đã bán 13,,4.0,,,,,,
https://tiki.vn/thuoc-duoi-ran-bot-duoi-ran-snake-shield-an-toan-voi-nguoi-p147325028.html?spid=147325029,Thuốc Đuổi Rắn - Bột Đuổi Rắn Snake Shield An toàn với người,OEM,126.000₫,Đã bán 200,4.5,,7,3,0,1,0,
https://tiki.vn/voi-xit-tang-ap-voi-phun-tang-ap-cuc-manh-bang-dong-rua-xe-tuoi-cay-phun-xuong-da-chuc-nang-p258135684.html?spid=263957565,"Vòi xịt tăng áp , Vòi phun tăng áp cực mạnh bằng đồng rửa xe, tưới cây phun xương đa chức năng..",OEM,34.999₫,Đã bán 12,4.0,,0,1,0,0,0,
https://tiki.vn/sieu-lan-kem-usa-kich-re-cuc-manh-bung-choi-xanh-cay-cuc-nhanh-sieu-lan-kem-usa-p197142766.html?spid=197142767,"[ SIÊU LÂN KẼM USA ] Kích Rễ Cực Mạnh, Bung Chồi Xanh Cây Cực Nhanh Siêu Lân Kẽm USA",OEM,190.000₫,Đã bán 86,5.0,,8,0,0,0,0,
https://tiki.vn/phan-de-da-qua-xu-ly-tui-luoi-dai-12cm-khong-mui-kich-re-kich-hoa-phong-lan-hoa-hong-greenhome-p190857198.html?spid=230203343,"Phân dê đã qua xử lý, túi lưới dài 10cm, không mùi, kích rễ, kích hoa phong Lan, hoa hồng |Greenhome",Greenhome,1.590₫,Đã bán 1654,4.8,4.0,11,0,0,1,0,
https://tiki.vn/cay-su-thai-kep-hoa-tim-cay-canh-trong-nha-tang-phan-bon-cho-cay-p177081696.html?spid=177081698,Cây Sứ Thái Kép Hoa Tím - cây cảnh để trong nhà + tặng phân bón cho cây,OEM,55.000₫,Đã bán 170,4.5,,22,10,0,1,1,
https://tiki.vn/o-du-gap-gon-mini-teement-19cm-du-che-mua-du-chong-tia-uv-mini-sieu-gon-8-xuong-co-hop-dung-chong-soc-hang-chinh-hang-p221011957.html?spid=260407156,"Ô Dù Gấp Gọn Mini Teement 19cm, Dù Che Mưa, Dù Chống Tia Uv Mini Siêu Gọn 8 Xương, Có Hộp Đựng Chống Sốc - Hàng Chính Hãng",TEEMENT,170.000₫,Đã bán 121,5.0,,8,1,0,0,0,
https://tiki.vn/cay-hong-mon-2-mau-p137998757.html?spid=150814558,Cây hồng môn 2 màu,OEM,45.000₫,Đã bán 57,4.7,,2,1,0,0,0,
https://tiki.vn/binh-xit-nuoc-tuoi-cay-tao-mau-toc-funu-cao-cap-hang-chinh-hang-giao-mau-ngau-nhien-p249694552.html?spid=249694553,"Bình xịt nước tưới cây, tạo mẫu tóc FuNu cao cấp - Hàng chính hãng, giao màu ngẫu nhiên",FuNu,42.750₫,Đã bán 25,5.0,,4,0,0,0,0,
https://tiki.vn/ao-mua-poncho-canh-doi-p16109078.html?spid=52263317,Áo Mưa Poncho Cánh Dơi,OEM,101.900₫,Đã bán 203,5.0,,41,2,1,0,0,
https://tiki.vn/hat-giong-rau-cai-bo-xoi-chiu-nhiet-20gr-goi-p135516895.html?spid=148703371,Hạt giống rau cải bó xôi chịu nhiệt - 20gr/gói,OEM,15.696₫,Đã bán 67,5.0,,7,0,0,0,0,
https://tiki.vn/luoi-che-nang-80-may-vien-khuy-mau-xanh-size-2m-x-3m-p76774851.html?spid=76774852,"LƯỚI CHE NẮNG 80% - MAY VIỀN, KHUY - MÀU XANH - SIZE 2M X 3M",OEM,300.000₫,Đã bán 62,4.6,,9,5,0,0,0,
https://tiki.vn/hat-giong-rau-tan-o-cai-cuc-p115739577.html?spid=172120830,Hạt giống Rau Tần Ô (Cải cúc),OEM,9.000₫,Đã bán 9,,,,,,,,
https://tiki.vn/dia-lot-chau-cay-dia-nhua-lot-chau-trong-cay-hinh-tron-dia-lot-da-nang-chat-luong-cao-ben-dep-nhieu-co-nhieu-mau-p195480690.html?spid=195480704,"Đĩa Lót Chậu Cây, Đĩa Nhựa Lót Chậu Trồng Cây Hình Tròn, Đĩa Lót Đa Năng Chất Lượng Cao, Bền Đẹp (Nhiều cỡ, Nhiều màu)",Hồng Thanh Garden,25.000₫,Đã bán 248,5.0,,14,1,0,0,0,
https://tiki.vn/ao-mua-bit-co-ban-p16166750.html?spid=52846385,ÁO MƯA BIT CƠ BẢN,OEM,95.000₫,Đã bán 81,4.6,,11,3,2,0,0,
https://tiki.vn/quan-ung-loi-nuoc-du-lam-ruong-du-size-tu-36_43-p203401927.html?spid=203401934,"quần ủng lội nước đủ, làm ruộng đủ size từ 36_43",OEM,105.000₫,Đã bán 56,4.5,,4,5,0,0,0,
https://tiki.vn/che-pham-sinh-hoc-bio-b-diet-sau-goi-30gr-p161948354.html?spid=161948356,Chế phẩm sinh học BIO B diệt sâu gói 30Gr,EOM,45.000₫,Đã bán 98,5.0,,4,0,0,0,0,
https://tiki.vn/phan-bon-kieng-la-monstera-bao-700gr-dam-choi-manh-cung-cay-re-khoe-la-to-day-greenhome-p217424219.html?spid=217424221,"Phân bón kiểng lá Monstera, bao 700gr, đâm chồi mạnh, cứng cây, rễ khoẻ, lá to, dày Greenhome",Greenhome,24.900₫,Đã bán 25,5.0,4.0,2,0,0,0,0,
https://tiki.vn/o-du-mo-nguoc-gap-gon-10-xuong-dong-mo-mot-nut-bam-p252676812.html?spid=252676818,Ô Dù Mở Ngược Gấp Gọn 10 Xương Đóng Mở Một Nút Bấm,NAVIVU,220.000₫,Đã bán 41,4.1,,5,0,1,0,1,
https://tiki.vn/khuon-chau-bonsai-mini-hinh-trai-dao-p187560875.html?spid=191217201,Khuôn chậu bonsai mini (hình trái đào),OEM,5.000₫,Đã bán 34,,,,,,,,
