Link,Name,Brand,Price,Sale,Stars,NumberOfCoupon,5 stars,4 stars,3 stars,2 stars,1 star,Reviews
https://tiki.vn/muong-dong-dinh-luong-phan-bon-dang-bot-2-dau-chia-vach-san-tien-loi-de-su-dung-greenhome-p259514009.html?spid=259514011,"Muỗng Đong Định Lượng Greenhome, 2 Đầu, Chia Vạch Sẵn, Tiện Lợi, Đong Phân Bón Dạng Bột, Gia Vị",Greenhome,1.800₫,Đã bán 589,,4.0,,,,,,
https://tiki.vn/o-du-chong-nang-che-mua-can-uv-tu-dong-dong-mo-khung-12-xuong-p186142362.html?spid=186142382,Ô Dù Chống Nắng Che Mưa Cản UV Tự Động Đóng Mở Khung 12 Xương,NAVIVU,230.000₫,Đã bán 361,4.7,,54,9,1,0,2,
https://tiki.vn/hat-giong-rau-cu-qua-thong-dung-de-trong-nay-mam-cao-p247061239.html?spid=247061355,Hạt Giống Rau Củ Quả Thông Dụng Dễ Trồng Nảy Mầm Cao,OEM,12.000₫,Đã bán 315,4.7,,37,0,0,2,2,
https://tiki.vn/ung-boc-giay-di-mua-dung-nhieu-lan-p8380873.html?spid=188730079,Ủng Bọc Giày Đi Mưa Dùng Nhiều Lần,OEM,68.000₫,Đã bán 92,4.2,,8,3,0,0,2,
https://tiki.vn/nuoc-lau-san-chuyen-dung-omo-roborock-danh-cho-robot-may-hut-bui-cam-tay-chong-nghet-ong-bom-dung-tich-480ml-p207801137.html?spid=207801138,"Nước lau sàn chuyên dụng Omo Roborock - Dành cho Robot, Máy hút bụi cầm tay, Chống nghẹt ống bơm, Dung tích 480ml",Roborock,407.000₫,Đã bán 14,,4.0,,,,,,
https://tiki.vn/may-rua-xe-xit-rua-cam-tay-dung-pin-24v-ap-luc-cao-phun-nuoc-da-nang-tang-binh-tao-bot-p186710171.html?spid=270205132,Máy Rửa Xe Xịt Rửa Cầm Tay Dùng Pin 24V Áp Lực Cao Phun Nước Đa Năng tặng bình tạo bọt,OEM,387.000₫,Đã bán 19,4.3,5.0,2,1,1,0,0,
https://tiki.vn/phan-bon-la-cao-cap-thai-lan-raja-npk-30-10-10-plus-hop-1kg-dam-choi-de-nhanh-tot-p176804898.html?spid=176804904,"Phân bón lá cao cấp Thái Lan RAJA Npk 30-10-10 plus hộp 1kg đâm chồi, đẻ nhánh tốt",OEM,139.000₫,Đã bán 8,5.0,,1,0,0,0,0,
https://tiki.vn/combo-100-mieng-boc-giay-p19570948.html?spid=59147874,combo 100 miếng bọc giày,OEM,41.097₫,Đã bán 77,4.6,,8,2,1,0,0,
https://tiki.vn/hat-giong-dua-chuot-baby-f1-nay-mam-cao-titapha-p66528947.html?spid=66528948,Hạt giống Dưa chuột Baby F1 nảy mầm cao Titapha,Titapha,13.900₫,Đã bán 1436,4.5,,129,37,5,1,9,
https://tiki.vn/be-boi-phao-boi-cho-be-3-tang-du-kich-co-p116300329.html?spid=270478751,Bể bơi phao bơi cho bé 3 tầng đủ kích cỡ,OEM,1.092.500₫,Đã bán 145,5.0,5.0,2,0,0,0,0,
https://tiki.vn/ao-mua-bit-vai-du-chong-tham-nuoc-cho-nguoi-lon-nhieu-mau-sac-tuoi-tre-phu-hop-cho-nam-va-nu-p271245822.html?spid=271245828,"Áo mưa bít vải dù chống thấm nước ,cho người lớn ,nhiều màu sắc tươi trẻ , phù hợp cho nam và nữ",OEM,151.050₫,Đã bán 20,4.5,6.0,2,2,0,0,0,
https://tiki.vn/chau-trong-cay-thong-minh-a7-co-chuc-nang-tu-tuoi-nuoc-cho-cay-p184521772.html?spid=184521778,Chậu trồng cây thông minh A7. Có chức năng tự tưới nước cho cây,OEM,55.000₫,Đã bán 772,4.8,,35,10,0,0,0,
https://tiki.vn/ung-boc-giay-di-mua-chong-nuoc-co-de-chong-tron-truot-cao-cap-p92521124.html?spid=92521130,Ủng Bọc Giày Đi Mưa Chống Nước Có Đế Chống Trơn Trượt Cao Cấp,OEM,79.000₫,Đã bán 1924,4.7,,241,55,6,0,5,
https://tiki.vn/ao-mua-canh-doi-vai-du-sieu-ben-loai-day-1-4m-giao-mau-ngau-nhien-p261810715.html?spid=261810716,Áo mưa cánh dơi vài dù siêu bền (loại dày 1.4m) - Giao màu ngẫu nhiên,PEAFLO,109.000₫,Đã bán 57,4.6,6.0,6,1,1,0,0,
https://tiki.vn/o-du-che-mua-co-lon-tu-dong-dong-mo-gap-gon-tien-loi-thiet-ke-mo-nguoc-chong-uot-khi-mo-gap-chinh-hang-nikita-p106208909.html?spid=106208911,"Ô dù che mưa cỡ lớn tự động đóng mở, gấp gọn tiện lợi - Thiết kế mở ngược chống ướt khi mở, gập - Chính hãng NIKITA",Nikita,159.000₫,Đã bán 800,4.8,5.0,156,22,6,1,2,
https://tiki.vn/binh-xit-tuoi-cay-monrovia-2-lit-phun-suong-tuoi-cay-canh-voi-dai-tang-voi-ngan-mau-xanh-tieu-chuan-chau-au-p109654810.html?spid=109654834,"Bình xịt tưới cây MONROVIA 2 lít, phun sương tưới cây cảnh, vòi dài, tặng vòi ngắn, màu xanh, tiêu chuẩn Châu Âu",Monrovia,169.000₫,Đã bán 1076,4.5,,191,31,5,3,16,
https://tiki.vn/o-du-che-nang-che-mua-co-nut-bam-2-chieu-hang-chat-luong-de-thuong-thiet-ke-sang-trong-va-ben-bi-o-du-co-lua-chon-mau-sac-p94778000.html?spid=94778032,"Ô Dù che nắng, che mưa, có nút bấm 2 chiều, hàng chất lượng, dễ thương, thiết kế sang trọng và bền bỉ, ô dù có lựa chọn màu sắc,",XUDI,196.000₫,Đã bán 1246,4.7,3.0,211,32,7,2,3,
https://tiki.vn/nuoc-duong-hoa-nuoc-cam-hoa-fresh-f5-duong-hoa-tuoi-lau-gap-3-lan-giup-hoa-no-bung-luon-tuoi-moi-p270702125.html?spid=270702126,"Nước Dưỡng Hoa, Nước Cắm Hoa Fresh F5 - Dưỡng Hoa Tươi Lâu Gấp 3 Lần, Giúp Hoa Nở Bung Luôn Tươi Mới",fofaHome,46.550₫,Đã bán 23,4.0,,0,1,0,0,0,
https://tiki.vn/thuoc-kich-re-n3m-chai-100ml-sieu-ra-re-giam-chiet-canh-ngam-hat-giong-greenhome-p190899609.html?spid=206669142,"Thuốc kích rễ N3M, chai 100ml, siêu ra rễ, giâm, chiết cành, ngâm hạt giống |Greenhome",Greenhome,29.000₫,Đã bán 76,4.5,4.0,4,2,1,0,0,
https://tiki.vn/bo-3-goi-hat-giong-hoa-cuc-van-tho-my-p26525668.html?spid=74169847,Bộ 3 gói Hạt giống hoa cúc vạn thọ mỹ - 200 hạt/gói,OEM,20.000₫,Đã bán 218,3.9,,13,1,0,1,4,
https://tiki.vn/goi-5-kg-phan-bon-dau-trau-huu-co-vi-sinh-cao-cap-trichoderma-te-giup-khang-benh-va-tang-truong-khoe-cho-cay-trong-p62734430.html?spid=62734431,Gói 5 Kg Phân bón đầu trâu hữu cơ vi sinh cao cấp Trichoderma + TE giúp kháng bệnh và tăng trưởng khỏe cho cây trồng,Bình Điền,125.000₫,Đã bán 659,4.7,,106,22,5,2,2,
https://tiki.vn/cay-ca-gai-leo-kho-dong-goi-1kg-cong-ty-tnhh-duoc-lieu-hong-lan-p142344577.html?spid=142344578,Cây CÀ GAI LEO khô sách đóng gói 1kg,OEM,115.000₫,Đã bán 54,4.5,,7,0,0,0,1,
https://tiki.vn/hat-giong-ca-chua-ca-chua-bi-lun-do-hat-giong-tot-1-goi-20-hat-p206143733.html?spid=206143736,Hạt giống cà chua cà chua bi lùn đỏ dể trồng f1-gói 20 hạt-tặng kèm gói phân bón lót,OEM,19.000₫,Đã bán 17,,,,,,,,
https://tiki.vn/day-buoc-canh-dai-50m-kem-boc-nhua-tich-hop-dao-cat-tien-loi-co-dinh-than-cay-lam-gian-greenhome-p190510330.html?spid=190515682,"Dây buộc cành, dài 50m, kẽm bọc nhựa, tích hợp dao cắt tiện lợi, cố định thân cây, làm giàn |Greenhome",Greenhome,26.900₫,Đã bán 103,5.0,4.0,8,0,0,0,0,
https://tiki.vn/phan-huu-co-dam-ca-1kg-tks-dang-vien-trong-rau-sach-hoa-hong-cay-canh-bang-dat-sach-xo-dua-mun-dua-phan-bon-huu-co-p133808448.html?spid=133808449,"Phân Hữu Cơ Đạm Cá 1KG TKS Dạng Viên - Trồng Rau Sạch, Hoa Hồng, Cây Cảnh Bằng Đất Sạch, Xơ Dừa Mùn Dừa, Phân Bón Hữu Cơ",TKS Thủy Kim Sinh,24.000₫,Đã bán 1935,4.7,,138,28,3,2,1,
https://tiki.vn/hat-giong-hoa-muoi-gio-my-kep-mix-nay-mam-cao-p58311830.html?spid=58311831,Hạt giống Hoa Mười giờ Mỹ kép - Mix nảy mầm cao,Titapha,18.000₫,Đã bán 3105,4.0,,177,53,21,6,46,
https://tiki.vn/may-bom-bong-bong-chinh-hang-midoctor-may-bom-bong-bay-2-voi-bang-dien-p44822929.html?spid=44822930,Máy Bơm Bong Bóng Chính Hãng miDoctor – Máy Bơm Bóng Bay 2 Vòi Bằng Điện,miDoctor,215.000₫,Đã bán 300,4.7,7.0,48,9,2,0,1,
https://tiki.vn/hat-giong-rau-thom-gia-vi-thao-moc-hanh-ngo-thi-la-de-trong-nay-mam-tot-p251417561.html?spid=251417856,"Hạt Giống Rau Thơm Gia Vị Thảo Mộc (Hành, Ngò, Thì Là,...) Dễ Trồng, Nảy Mầm Tốt",OEM,11.900₫,Đã bán 17,,,,,,,,
https://tiki.vn/bang-keo-ghep-canh-cay-tu-dinh-tu-huy-bao-ve-moi-ghep-nhanh-lien-nhieu-kich-thuoc-greenhome-p204985175.html?spid=204985177,"Keo Ghép Cành Greenhome, Tự Dính, Tự Huỷ, Bảo Vệ Mối Ghép Nhanh Liền, Dễ Sử Dụng, Nhiều Kích Thước",Greenhome,25.900₫,Đã bán 36,3.0,4.0,1,0,0,0,1,
https://tiki.vn/hat-giong-hoa-huong-duong-thap-sieu-hoa-vts110-p68237257.html?spid=68237258,Hạt giống hoa Hướng Dương Tháp siêu hoa VTS110,Sen Vàng Seeds,15.000₫,Đã bán 479,4.6,,37,5,2,1,2,
https://tiki.vn/ao-mua-mot-nguoi-trong-suot-co-non-thoi-trang-nhua-eva-su-dung-nhieu-lan-p247298318.html?spid=247298320,"Áo Mưa Một Người Trong Suốt Có Nón Thời Trang, Nhựa EVA Sử Dụng Nhiều Lần",NAVIVU,45.000₫,Đã bán 319,4.8,,23,6,0,0,0,
https://tiki.vn/1kg-day-nhom-uon-cay-canh-day-nhom-uon-cay-bonsai-p85402049.html?spid=85402062,1kg DÂY NHÔM UỐN CÂY CẢNH - DÂY NHÔM UỐN CÂY BONSAI,OEM,145.000₫,Đã bán 341,4.6,1.0,39,5,0,0,3,
https://tiki.vn/cay-hoa-nhai-hoa-lai-cao-400-cm-anh-that-so-hoa-no-quanh-nam-p108684816.html?spid=150805863,Cây hoa nhài - hoa lài cao 400 cm (ảnh thật số) hoa nở quanh năm,OEM,18.000₫,Đã bán 90,4.6,,13,1,1,0,1,
https://tiki.vn/ung-boc-giay-di-mua-chong-nuoc-co-de-chong-tron-truot-cao-cap-p181972675.html?spid=181972681,Ủng Bọc Giày Đi Mưa Chống Nước Có Đế Chống Trơn Trượt Cao Cấp,OEM,79.000₫,Đã bán 148,4.5,,13,5,2,0,1,
https://tiki.vn/cay-giong-rau-bina-chaya-cay-giong-trong-bau-dat-cay-to-map-khoe-p258275756.html?spid=258275786,"cây giống rau bina chaya - cây giống trồng bầu đất, cây to , mập ,khỏe",OEM,25.000₫,Đã bán 21,2.0,,0,0,0,1,0,
https://tiki.vn/bo-3-chau-nhua-trong-cay-28x24cm-nhua-cung-thoat-nuoc-tot-da-dang-kich-thuoc-trong-cay-hoa-kieng-la-greenhome-p190726737.html?spid=212924697,"Bộ 3 Chậu nhựa trồng cây, nhiều kích thước, thoát nước tốt, đa dạng kích thước trồng cây, hoa, kiểng lá |Greenhome",Greenhome,57.000₫,Đã bán 92,4.8,4.0,4,1,0,0,0,
https://tiki.vn/hat-giong-rau-mui-ngo-f1-nay-mam-cao-titapha-p107371026.html?spid=107371028,Hạt giống Rau mùi ( ngò) F1 - Nảy mầm cao Titapha,Titapha,13.900₫,Đã bán 535,4.6,1.0,48,15,1,1,1,
https://tiki.vn/de-lot-chau-cay-co-banh-xe-greenhome-duong-kinh-30-cm-chiu-luc-80kg-chat-lieu-go-tram-bong-vang-p58881563.html?spid=182841289,Đế lót chậu cây có bánh xe Greenhome-Đường kính 30 cm chịu lực 80kg- Chất liệu Gỗ Tràm Bông Vàng,Greenhome,59.900₫,Đã bán 92,4.8,1.0,4,1,0,0,0,
https://tiki.vn/hat-giong-hoa-cac-loai-trong-chau-trong-tham-nay-mam-tot-p251417531.html?spid=251417863,"Hạt Giống Hoa Các Loại Trồng Chậu, Trồng Thảm Nảy Mầm Tốt",OEM,11.900₫,Đã bán 13,,,,,,,,
https://tiki.vn/ung-boc-giay-di-mua-di-phuot-chong-nuoc-co-de-chong-truot-mau-xanh-p23142259.html?spid=188728492,Ủng bọc giày đi mưa đi phượt chống nước có đế chống trượt - màu xanh,OEM,32.726₫,Đã bán 30,,,,,,,,
https://tiki.vn/binh-xit-nuoc-tuoi-cay-2-lit-phun-suong-tuoi-cay-thuoc-muoi-voi-xit-dieu-chinh-nhieu-che-do-che-do-tuoi-tu-dong-van-giam-ap-cong-nghe-nhat-ban-p181151849.html?spid=201622091,"Bình xịt nước tưới cây 2 lít, phun sương tưới cây, thuốc muỗi, vòi xịt điều chỉnh nhiều chế độ, chế độ tưới tự động, van giảm áp, công nghệ Hàn Quốc.",OEM,65.000₫,Đã bán 446,4.8,,90,12,1,1,1,
https://tiki.vn/hat-giong-hoa-dong-tien-f1-mix-giong-nay-mam-khoe-hoa-to-vts115-p71003207.html?spid=71003208,Hạt giống Hoa Đồng Tiền F1 Mix - giống nẩy mầm khỏe hoa to VTS115,Sen Vàng Seeds,17.000₫,Đã bán 852,3.9,,63,31,3,5,22,
https://tiki.vn/hat-giong-hoa-huong-duong-do-nay-mam-khoe-hoa-to-vts08-p79169287.html?spid=79169288,Hạt giống hoa Hướng Dương Đỏ nảy mầm khỏe hoa to VTS08,Sen Vàng Seeds,17.000₫,Đã bán 233,4.8,,29,4,1,0,0,
https://tiki.vn/o-du-gap-gon-tu-dong-chong-tia-uv-cao-cap-mau-tron-p196552579.html?spid=196552589,"Ô Dù gấp gọn , dù che mưa , chống tia UV 8 nan ( nhiều mẫu )",OEM,89.000₫,Đã bán 404,4.7,,35,9,1,0,1,
https://tiki.vn/bot-tay-rong-reu-nen-nha-xi-mang-tuong-xi-mang-gach-san-vuon-sieu-nhanh-sieu-sach-p263574991.html?spid=263574993,"Bột tẩy rong rêu nền nhà xi măng, tường xi măng, gạch, sân vườn,",OEM,65.000₫,Đã bán 18,5.0,,1,0,0,0,0,
https://tiki.vn/voi-rua-xe-5-met-gh05-p14088151.html?spid=14088152,Vòi rửa xe 5 mét GH05,OEM,195.000₫,Đã bán 130,4.5,,9,6,2,0,0,
https://tiki.vn/ong-tuoi-phun-mua-phi-27-hang-cao-cap-pm27-cuon-100m-p145274921.html?spid=145274922,ỐNG TƯỚI PHUN MƯA PHI 27- HÀNG CAO CẤP - PM27 - CUỘN 100M,OEM,170.000₫,Đã bán 135,4.1,3.0,9,4,1,0,2,
https://tiki.vn/bun-trong-hoa-sen-p248330892.html?spid=248330893,"2,5Kg Bùn Trồng Hoa Sen Hoa Súng, Bùn Trộn Được Sẵn Phân Bón Theo Tỉ Lệ Của Mini Garden Phù Hợp Trồng Hoa Sen, Hoa Súng",OEM,37.500₫,Đã bán 34,5.0,,2,0,0,0,0,
https://tiki.vn/may-rua-xe-mini-hitachi-cam-tay-pin-199v-ap-luc-p158785283.html?spid=271141834,"MÁY rửa xe mini, Hitachi cầm tay pin 199v áp lực,",OEM,212.000₫,Đã bán 9,5.0,,1,0,0,0,0,
https://tiki.vn/hat-giong-hoa-cuc-bach-nhat-nhieu-mau-vts147-p87624516.html?spid=87624517,Hạt giống hoa Cúc Bách Nhật nhiều màu VTS147,Sen Vàng Seeds,17.000₫,Đã bán 206,4.7,,19,4,0,1,0,
https://tiki.vn/may-cat-co-tia-canh-cam-tay-lapusen-pin-khung-15000mah-dong-co-manh-1800w-p196362415.html?spid=196362417,"Máy cắt cỏ, tỉa cành cầm tay LAPUSEN pin khủng 15000mah, động cơ mạnh 1800w",lapusen,988.000₫,Đã bán 169,4.0,2.0,20,6,1,0,6,
https://tiki.vn/day-thien-ly-sieu-hoa-thom-nut-mui-cay-canh-san-vuon-p152446758.html?spid=152446759,Dây Thiên Lý .... siêu hoa... thơm nứt mũi - cây cảnh vườn,OEM,35.000₫,Đã bán 89,4.1,,5,2,0,2,0,
https://tiki.vn/dam-ca-co-dac-sbc-can-5lit-phan-bon-huu-co-dam-dac-toi-xop-dat-kich-re-phat-dot-bat-mam-xanh-cay-p251770097.html?spid=251770102,"Đạm Cá Cô Đặc SBC Can 5Lit – Phân Bón Hữu Cơ Đậm Đặc, Tơi Xốp Đất, Kích Rễ, Phát Đọt, Bật Mầm, Xanh Cây",OEM,309.000₫,Đã bán 13,5.0,,2,0,0,0,0,
https://tiki.vn/la-phan-ta-diep-kho-500gram-p205175767.html?spid=205175768,Lá Phan Tả Diệp khô 500gram,OEM,79.000₫,Đã bán 72,5.0,,4,0,0,0,0,
https://tiki.vn/dat-huu-co-da-dung-trong-rau-sach-trong-cay-trong-kieng-trong-hoa-p271414468.html?spid=271414471,"Đất Hữu Cơ Đa Dụng Trồng Rau Sạch, Trồng Cây, Trồng Kiễng, Trồng Hoa...",Lavamix,39.000₫,Đã bán 21,,1.0,,,,,,
https://tiki.vn/keo-cat-canh-cong-luc-nhap-khau-tu-japan-cao-cap-keo-sk5-bang-thep-duc-nguyen-khoi-tay-boc-go-xin-so-p198436526.html?spid=198436528,Kéo cắt cành cộng lực cao cấp nhập khẩu từ JAPAN -kéo SK5 bằng thép đúc nguyên khối tay bọc gỗ xịn sò,OEM,195.000₫,Đã bán 127,5.0,,24,3,0,0,0,
https://tiki.vn/cha-u-ca-y-de-ba-n-monrovia-cho-hoa-cay-canh-ban-cong-bonsai-p186619847.html?spid=186619859,"Chậu cây để bàn MONROVIA cho hoa, cây cảnh, ban công, bonsai",Monrovia,44.000₫,Đã bán 402,5.0,,32,1,0,1,0,
https://tiki.vn/phan-trun-que-nguyen-chat-lavamix-2kg-phan-huu-co-bon-rau-va-cay-canh-tron-gia-the-dat-sach-xo-duatrong-cay-p117002224.html?spid=117002228,"Phân Trùn Quế Nguyên Chất Lavamix 2Kg Phân Hữu Cơ Bón Rau và Cây Cảnh, Trộn Giá Thể Đất Sạch Xơ DừaTrồng Cây",Lavamix,23.000₫,Đã bán 1013,4.7,,78,14,1,0,2,
https://tiki.vn/roi-may-deo-dai-sieu-than-thanh-p164771128.html?spid=164771129,Roi mây dẻo dai siêu thần thánh,OEM,22.500₫,Đã bán 446,4.7,,16,6,0,0,0,
https://tiki.vn/goc-hoa-hong-leo-phap-khach-duoc-chon-mau-theo-yeu-cau-tang-kich-re-khi-mua-tu-5-goc-p196675125.html?spid=196675127,GỐC HOA HỒNG LEO PHÁP- KHÁCH ĐƯỢC CHỌN MÀU THEO YÊU CẦU -tặng kích rễ khi mua từ 5 gốc,OEM,7.900₫,Đã bán 169,5.0,,7,1,0,0,0,
https://tiki.vn/luoi-che-nang-rong-4-met-han-quoc-che-mai-hien-che-hoa-lan-co-may-vien-dong-khoen-p171661262.html?spid=171661264,"Lưới che nắng rộng 4 mét Hàn Quốc, Che Mái Hiên, Che Hoa Lan (Có May Viền Đóng Khoen)",OEM,140.000₫,Đã bán 149,5.0,,8,0,0,0,0,
https://tiki.vn/o-gap-gon-chong-tia-uv-p17000892.html?spid=57830508,Ô gấp gọn chống tia UV,OEM,51.900₫,Đã bán 306,4.5,,35,10,1,0,4,
https://tiki.vn/bo-10-dau-tuoi-nap-chai-nho-giot-tu-dong-thong-minh-co-dieu-chinh-tuoi-hoa-cay-canh-p59047203.html?spid=187058160,"Bộ 10 đầu tưới nắp chai nhỏ giọt tự động thông minh có điều chỉnh ( tưới hoa, cây cảnh )",OEM,28.999₫,Đã bán 1107,4.5,,66,33,2,3,5,
https://tiki.vn/muoi-epsom-salt-2kg-magnesium-sulfate-mgso4-epsom-salt-p45469256.html?spid=45469257,Muối Epsom Salt 2kg - MAGNESIUM SULFATE MgSO4 epsom salt,OEM,155.000₫,Đã bán 1802,4.7,,152,37,5,1,1,
https://tiki.vn/hat-giong-rau-thom-sa-e-trang-rado-189-rang-dong-goi-5gram-p184495640.html?spid=184495641,Hạt giống rau thơm sả ( é trắng ) RADO 189 Rạng Đông - Gói 5gram,Rạng Đông,9.000₫,Đã bán 50,5.0,,8,0,0,0,0,
https://tiki.vn/02-goi-hat-giong-hoa-cuc-ngu-sac-zinnia-italy-vtp73-p55503591.html?spid=55503593,02 gói Hạt giống hoa cúc ngũ sắc Zinnia Italy VTP73,OEM,22.000₫,Đã bán 413,4.5,,36,10,5,2,1,
https://tiki.vn/binh-xit-nuoc-binh-xit-tuoi-cay-bang-nhua-binh-xit-nuoc-tao-mau-toc-mohi-mx01-chinh-hang-ngau-nhien-p89642725.html?spid=89642726,"Bình xịt nước tưới cây bằng nhựa, bình xịt nước tạo mẫu tóc, xịt nước làm bánh cao cấp - Hàng chính hãng, giao màu ngẫu nhiên",MO hi,55.100₫,Đã bán 604,4.8,,62,10,1,0,1,
https://tiki.vn/gang-tay-lam-vuon-cao-cap-ansell-11-801-p73371758.html?spid=73371767,Găng tay làm vườn cao cấp Ansell 11-801,OEM,68.000₫,Đã bán 446,4.7,,52,13,2,0,1,
https://tiki.vn/o-du-che-mua-nang-o-chong-tia-uv-du-8-nan-cam-tay-gap-gon-tien-loi-hang-chinh-hang-dododios-p208537347.html?spid=208537353,"Ô Dù Che Mưa Nắng, Ô Chống Tia UV, Dù 8 Nan Cầm Tay Gấp Gọn Tiện Lợi - Hàng chính hãng dododios",dododios,49.900₫,Đã bán 193,4.6,,12,3,0,0,1,
https://tiki.vn/hat-giong-hoa-van-tho-mix-vtp77-p191672393.html?spid=191672394,Hạt giống hoa vạn thọ Mix VTP77,OEM,13.000₫,Đã bán 45,3.8,,1,3,0,1,0,
https://tiki.vn/binh-xit-phun-suong-350ml-song-long-p17627242.html?spid=183578786,Bình xịt phun sương 350ml - Song Long,Song Long,15.000₫,Đã bán 12,5.0,,1,0,0,0,0,
https://tiki.vn/be-boi-cho-be-be-boi-gia-dinh-be-boi-cac-loai-gia-re-be-boi-phao-cho-be-be-boi-bang-phao-tre-em-bao-hanh-1-doi-1-p119111659.html?spid=270464810,"Bể bơi cho bé- Bể bơi gia đình - Bể bơi các loại, Bể bơi Phao Cho bé - Bể bơi Bằng Phao Trẻ em Kích Thước Lớn",OEM,1.035.500₫,Đã bán 79,4.8,5.0,5,1,0,0,0,
https://tiki.vn/bo-dieu-khien-sac-nang-luong-mat-troi-30a-tu-dong-nhan-binh-12v-24v-p45324464.html?spid=184095224,Bộ điều khiển sạc năng lượng mặt trời 30A tự động nhận bình 12V 24V,OEM,62.000₫,Đã bán 39,4.5,,4,2,1,0,0,
https://tiki.vn/hat-giong-ca-chua-do-qua-to-f1-nay-mam-cao-titapha-p103822707.html?spid=103822709,Hạt giống Cà chua đỏ quả to F1 - Nảy mầm cao Titapha,Titapha,13.900₫,Đã bán 410,4.3,1.0,34,7,0,0,6,
https://tiki.vn/luoi-cat-co-tan-goc-soi-thep-sieu-ben-tang-moc-chia-khoa-p173558017.html?spid=173558023,Lưỡi cắt cỏ tận gốc sợi thép siêu bền,OEM,85.000₫,Đã bán 87,4.7,,7,3,0,0,0,
https://tiki.vn/o-du-che-mua-co-lon-tu-dong-dong-mo-gap-gon-tien-loi-thiet-ke-mo-nguoc-chong-uot-khi-mo-gap-chinh-hang-nikita-p106208918.html?spid=106208922,"Ô dù che mưa cỡ lớn tự động đóng mở, gấp gọn tiện lợi - Thiết kế mở ngược chống ướt khi mở, gập - Chính hãng NIKITA",Nikita,159.000₫,Đã bán 425,4.8,5.0,50,6,2,0,1,
https://tiki.vn/100-tui-bao-oi-cam-na-vu-sua-tui-boc-trai-cay-phong-ngua-sau-benh-pha-hoai-dang-rut-tui-chuyen-dung-p85351583.html?spid=85351585,"100 Túi bao Ổi, Cam, Na, Vú Sữa,.. túi bọc trái cây phòng ngừa sâu bệnh phá hoại - Dạng Rút Túi Chuyên Dụng",OEM,32.000₫,Đã bán 1012,4.3,1.0,78,28,3,2,10,
https://tiki.vn/van-dien-tu-phi-21-phi-27-phi-34-thuong-dong-220v-van-thoat-nuoc-van-nuoc-dieu-khien-bang-dien-p145131094.html?spid=145131126,"Van điện từ phi 21, phi 27,phi 34 thường đóng 220V, van thoát nước, van nước điều khiển bằng điện",OEM,208.000₫,Đã bán 61,4.5,,9,4,0,1,0,
https://tiki.vn/hat-giong-hoa-cuc-vang-cuc-dai-doa-p165767772.html?spid=194498848,HẠT GIỐNG HOA CÚC VÀNG (CÚC ĐẠI ĐÓA),OEM,10.000₫,Đã bán 14,,,,,,,,
https://tiki.vn/cay-lai-hoang-de-lai-hawai-cho-hoa-lau-tan-huong-rat-thom-tang-phan-bon-p193738612.html?spid=193738613,"Cây Lài Hoàng Đế (Lài Hawai cho hoa lâu tàn, hương rất thơm) + tặng phân bón",OEM,45.000₫,Đã bán 25,4.7,,2,1,0,0,0,
https://tiki.vn/100-tui-luoi-tot-bao-boc-mit-thai-kich-thuoc-50-70cm-tui-boc-trai-cay-p183915534.html?spid=183915537,100 Túi Lưới Tốt Bao Bọc Mít Thái Kích Thước 50*70cm - Túi Bọc Trái Cây,OEM,70.000₫,Đã bán 127,4.6,,17,4,0,0,1,
https://tiki.vn/bo-may-rua-xe-cam-tay-2-pin-hi-ta-chi-199v-cuc-khoe-may-xit-rua-tang-ap-hang-loi-dong-chuan-cong-ty-p261808759.html?spid=261808760,Bộ Máy Rửa Xe Cầm Tay 2 Pin 199V Cực Khỏe - Máy Xịt Rửa Tăng Áp Hàng Lõi Đồng Chuẩn Công Ty,OEM,444.444₫,Đã bán 98,3.9,,5,7,4,0,1,
https://tiki.vn/02-goi-hat-giong-hoa-sao-nhai-mix-hoa-chuon-chuon-nhieu-mau-vtp86-p59538696.html?spid=59538697,02 gói Hạt giống hoa sao nhái mix - hoa cúc sao nhái nhiều màu - hoa chuồn chuồn nhiều màu VTP86,OEM,22.000₫,Đã bán 339,4.7,,30,7,0,0,1,
https://tiki.vn/02-goi-hat-giong-hoa-bat-tu-nhieu-mau-italy-vtp69-p55502646.html?spid=73870797,02 gói Hạt giống hoa bất tử nhiều màu Italy VTP69,OEM,15.000₫,Đã bán 446,3.9,,39,14,4,0,14,
https://tiki.vn/phan-bon-sieu-tao-nu-mai-vang-10-60-10-chai-500ml-p242106817.html?spid=242106821,Phân bón siêu tạo nụ mai vàng 10 60 10 chai 500ml,OEM,95.000₫,Đã bán 9,5.0,,1,0,0,0,0,
https://tiki.vn/don-go-de-cay-canh-trang-tri-nha-cua-don-go-de-chau-hoa-bang-go-thong-dep-02-p173151250.html?spid=173151256,"ĐÔN GỖ ĐỂ CÂY CẢNH TRANG TRÍ NHÀ CỬA, ĐÔN GỖ ĐỂ CHẬU HOA BẰNG GỖ THÔNG ĐẸP-02",anzzar,95.000₫,Đã bán 143,4.5,4.0,14,3,2,0,1,
https://tiki.vn/tam-bat-che-mua-nang-che-cay-che-san-vuon-han-quoc-01-met-vuong-p115621849.html?spid=115621853,"Tấm Bạt Che Mưa Nắng, Che cây, che sân vườn Hàn Quốc 01 mét vuông .",OEM,18.000₫,Đã bán 196,4.5,,7,3,0,0,1,
https://tiki.vn/ao-mua-gai-nut-trong-suot-chong-tham-day-dan-tien-loi-de-mac-khong-can-coi-non-bao-hiem-p251590902.html?spid=251590914,Áo Mưa Gài Nút Trong Suốt Chống Thấm Dày Dặn Tiện Lợi Dễ Mặc Không Cần Cởi Nón Bảo Hiểm,OEM,129.000₫,Đã bán 60,3.5,,6,1,0,1,3,
https://tiki.vn/phan-bon-npk-20-20-15-te-da-nang-3-ma-u-1kg-p6137123.html?spid=6137125,"Phân Bón Npk 20-20-15 đa năng 3 màu (1Kg)- bón cây, rau, cây ăn trái, hoa kiểng - bón gốc dễ sử dụng, kích thích ra lá, ra hoa, đậu trái",Bình Điền Mekong,45.000₫,Đã bán 1268,4.6,,111,36,3,3,4,
https://tiki.vn/voi-tuoi-cay-gian-no-da-nang-loai-30m-voi-xit-nuoc-thong-minh-p151553282.html?spid=193234410,Vòi Tưới Cây Giãn Nở Đa Năng Loại 30m - Vòi Xịt Nước Thông Minh,OEM,93.079₫,Đã bán 61,4.0,,3,2,0,0,1,
https://tiki.vn/du-che-mua-smartchoice-o-du-gap-gon-cao-cap-3-lop-chong-tia-uv-co-hop-dung-thoi-trang-p242086158.html?spid=242086160,Dù Che Mưa SMARTCHOICE – Ô Dù Gấp Gọn Cao Cấp 3 Lớp Chống Tia UV Có Hộp Đựng Thời Trang,SmartChoice,169.000₫,Đã bán 208,4.3,,19,5,0,2,2,
https://tiki.vn/gia-si-ao-mua-bo-nilon-tien-loi-di-duong-di-phuot-p192018810.html?spid=192018811,"Áo mưa Bộ Nilon Tiện lợi Đi Đường,Đi Phượt",OEM,13.000₫,Đã bán 150,3.8,,2,1,0,0,1,
https://tiki.vn/ao-mua-bo-thanh-long-vai-du-2-lop-cao-cap-p89054016.html?spid=217085304,ÁO MƯA BỘ THÀNH LONG VẢI DÙ 2 LỚP CAO CẤP,OEM,184.997₫,Đã bán 24,5.0,,2,0,0,0,0,
https://tiki.vn/cay-chanh-tu-quy-cao-40-50-cm-tang-phan-bon-cho-cay-p173820029.html?spid=173820032,Cây chanh tứ quý - cây ăn quả + tặng phân bón cho cây,OEM,35.000₫,Đã bán 80,4.3,,11,5,2,0,1,
https://tiki.vn/10-hat-giong-hoa-sen-mini-nhat-mau-ngau-nhien-nong-san-vang-p92387171.html?spid=92387172,10 Hạt giống Hoa Sen Mini Nhật ( Màu Ngẫu Nhiên ) - Nông Sản Vàng,Nông Sản Vàng,17.000₫,Đã bán 1091,4.7,,114,23,3,1,4,
https://tiki.vn/dau-keo-cat-canh-cay-tren-cao-tia-cay-canh-hai-hoa-qua-p113965262.html?spid=116120153,"Đầu kéo cắt cành cây trên cao, tỉa cây cảnh, hái hoa quả",OEM,55.000₫,Đã bán 220,4.6,,30,16,1,0,0,
https://tiki.vn/phan-huu-co-dam-ca-1kg-tks-dang-vien-key-hat-giong-rau-cu-qua-dat-sach-phan-bon-huu-co-xo-dua-p179993260.html?spid=179993261,"Phân Bón Hữu Cơ Đạm Cá 1KG TKS Dạng Viên - Shop Hạt Giống Rau Củ Quả, Đất sạch, Phân Bón, Hữu Cơ, Xơ Dừa",OEM,24.440₫,Đã bán 333,4.6,,13,8,0,0,0,
https://tiki.vn/hat-giong-dau-coove-f1-nay-mam-cao-titapha-p108962362.html?spid=108962366,Hạt giống Đậu Coove F1 - Nảy mầm cao Titapha,Titapha,19.000₫,Đã bán 95,4.3,1.0,12,4,1,0,2,
https://tiki.vn/goi-1kg-hat-giong-hoa-sao-nhai-f1-mix-nhieu-mau-loai-de-trong-hoa-no-dep-tong-kho-hat-giong-gia-re-p273104362.html?spid=273104363,"(Gói 1kg )Hạt Giống Hoa Sao Nhái F1 Mix Nhiều Màu Loại Dễ Trồng, Hoa Nở Đẹp-Tổng kho hạt giống giá rẻ",OEM,187.500₫,Đã bán 4,,,,,,,,
https://tiki.vn/ong-loi-thep-boc-nhua-phi-8-combo-10-ong-p68459703.html?spid=68459713,"10 ống thép bọc nhựa phi 8 của nhật có nhiều kích thước lựa chọn dùng bền trên 5 năm chuyên dùng làm khung giàn cho cây leo, cắm chống đỡ cây trồng",DAIM,245.000₫,Đã bán 524,5.0,,86,14,0,0,0,
